director,user_rating,runtime,link,description,star1,star2,star3,star4,title,year,rank
Lasse HallstrÕ_m,7.4,126 mins.,/title/tt0124315/,"A compassionate young man,  raised in an orphanage and trained to be a doctor there,  decides to leave to see the world. ",Tobey Maguire, Charlize Theron, Michael Caine, Delroy Lindo,The Cider House Rules,1999,1698
Jon Amiel,6.2,113 mins.,/title/tt0137494/,An insurance agent is sent by her employer to track down and help capture an art thief. ,Sean Connery, Catherine Zeta-Jones, Ving Rhames, Will Patton,Entrapment,1999,1699
Raja Gosnell,6,107 mins.,/title/tt0151738/,A newspaper reporter enrolls in high school as part of research for a story. ,Drew Barrymore, David Arquette, Michael Vartan, Molly Shannon,Never Been Kissed,1999,1700
Eric 'Bibo' Bergeron,6.9,89 mins.,/title/tt0138749/,"Two swindlers get their hands on a map to the fabled city of gold,  El Dorado. ",Kevin Kline, Kenneth Branagh, Rosie Perez, Armand Assante,The Road to El Dorado,2000,1701
Jonathan Lynn,6.7,98 mins.,/title/tt0190138/,"A struggling dentist's life is turned upside down when a famous gangster moves in next door,  and his wife convinces him to inform a notorious mob boss about the gangster's whereabouts. ",Bruce Willis, Matthew Perry, Rosanna Arquette, Michael Clarke Duncan,The Whole Nine Yards,2000,1702
Roger Spottiswoode,5.9,123 mins.,/title/tt0216216/,Futuristic action about a man who meets a clone of himself and stumbles into a grand conspiracy about clones taking over the world. ,Arnold Schwarzenegger, Michael Rapaport, Tony Goldwyn, Michael Rooker,The 6th Day,2000,1703
Harold Ramis,6,93 mins.,/title/tt0230030/,"Hopeless dweeb Elliot Richards is granted seven wishes by the Devil to snare Allison,  the girl of his dreams,  in exchange for his soul. ",Brendan Fraser, Elizabeth Hurley, Frances O'Connor, Miriam Shor,Bedazzled,2000,1704
Tarsem Singh,6.3,107 mins.,/title/tt0209958/,"An FBI agent persuades a social worker,  who is adept with a new experimental technology,  to enter the mind of a comatose serial killer in order to learn where he has hidden his latest kidnap victim. ",Jennifer Lopez, Vince Vaughn, Vincent D'Onofrio, Colton James,The Cell,2000,1705
Eric Leighton,6.5,82 mins.,/title/tt0130623/,An orphaned dinosaur raised by lemurs joins an arduous trek to a sancturary after a meteorite shower destroys his family home. ,D.B. Sweeney, Julianna Margulies, Alfre Woodard, Ossie Davis,Dinosaur,2000,1706
Gregory Hoblit,7.4,118 mins.,/title/tt0186151/,"An accidental cross-time radio link connects father and son across 30 years. The son tries to save his father's life,  but then must fix the consequences. ",Dennis Quaid, Jim Caviezel, Shawn Doyle, Elizabeth Mitchell,Frequency,2000,1707
Howard Deutch,6.5,118 mins.,/title/tt0191397/,"During a pro football strike,  the owners hire substitute players. ",Keanu Reeves, Gene Hackman, Brooke Langton, Orlando Jones,The Replacements,2000,1708
Robert Zemeckis,6.6,130 mins.,/title/tt0161081/,The wife of a university research scientist believes that her lakeside Vermont home is haunted by a ghost - or that she is losing her mind. ,Harrison Ford, Michelle Pfeiffer, Katharine Towne, Miranda Otto,What Lies Beneath,2000,1709
Ivan Reitman,6,101 mins.,/title/tt0251075/,"A fire-fighting cadet,  two college professors,  and a geeky but sexy government scientist work against an alien organism that has been rapidly evolving since its arrival on Earth inside a meteor. ",David Duchovny, Orlando Jones, Julianne Moore, Seann William Scott,Evolution,2001,1710
Andrzej Bartkowiak,5.5,101 mins.,/title/tt0242445/,"Orin Boyd,  a tough cop in an inner-city precinct discovers a web of dirty cops and corruption. ",Steven Seagal, DMX, Isaiah Washington, Anthony Anderson,Exit Wounds,2001,1711
Robert Altman,7.3,131 mins.,/title/tt0280707/,The lives of upstairs guests and downstairs servants at a party in 1932 in a country house in England as they investigate a murder involving one of them. ,Maggie Smith, Ryan Phillippe, Michael Gambon, Kristin Scott Thomas,Gosford Park,2001,1712
Iain Softley,7.4,120 mins.,/title/tt0272152/,"PROT is a patient at a mental hospital who claims to be from a far away planet. His psychiatrist tries to help him,  only to begin to doubt his own explanations. ",Kevin Spacey, Jeff Bridges, Mary McCormack, Alfre Woodard,K-PAX,2001,1713
James Wong,5.9,87 mins.,/title/tt0267804/,A sheriff's deputy fights an alternate universe version of himself who grows stronger with each alternate self he kills. ,Jet Li, Carla Gugino, Delroy Lindo, Jason Statham,The One,2001,1714
Frank Oz,6.8,124 mins.,/title/tt0227445/,An aging thief hopes to retire and live off his ill-gotten wealth when a young kid convinces him into doing one last heist. ,Robert De Niro, Edward Norton, Marlon Brando, Angela Bassett,The Score,2001,1715
Steve Beck,5.5,91 mins.,/title/tt0245674/,"When Cyrus Kriticos,  a very rich collector of unique things dies,  he leaves it all to his nephew and his family. All including his house,  his fortune,  and his malicious collection of ghosts! ",Tony Shalhoub, Shannon Elizabeth, Embeth Davidtz, Matthew Lillard,Thir13en Ghosts,2001,1716
Alexander Payne,7.2,125 mins.,/title/tt0257360/,A man upon retirement embarks on a journey to his estranged daughter's wedding only to discover more about himself and life than he ever expected. ,Jack Nicholson, Hope Davis, Dermot Mulroney, Kathy Bates,About Schmidt,2002,1717
Callie Khouri,6,116 mins.,/title/tt0279778/,"After years of mother-daughter tension,  Siddalee receives a scrapbook detailing the wild adventures of the ""Ya-Yas"",  her mother's girlhood friends. ",Sandra Bullock, Ellen Burstyn, Fionnula Flanagan, James Garner,Divine Secrets of the Ya-Ya Sisterhood,2002,1718
Marcus Raboy,5.8,85 mins.,/title/tt0293815/,Craig and Day Day have finally moved out of their parents houses and into their own crib. The cousins work nights at a local mall as security guards... ,Ice Cube, Mike Epps, John Witherspoon, Don 'D.C.' Curry,Friday After Next,2002,1719
Ed Decter,5.9,88 mins.,/title/tt0241760/,A high school senior branded uncool in the ninth grade gets himself expelled so he changes his image to cool kid at the town's other high school. ,DJ Qualls, Lyle Lovett, Eliza Dushku, Zooey Deschanel,The New Guy,2002,1720
Andrew Niccol,6.1,117 mins.,/title/tt0258153/,"A producer's film is endangered when his star walks off,  so he decides to digitally create an actress to substitute for the star,  becoming an overnight sensation that everyone thinks is a real person. ",Al Pacino, Catherine Keener, Rachel Roberts, Benjamin Salisbury,S1m0ne,2002,1721
Steven Soderbergh,6.2,99 mins.,/title/tt0307479/,A troubled psychologist is sent to investigate the crew of an isolated research station orbiting a bizarre planet. ,George Clooney, Natascha McElhone, Ulrich Tukur, Viola Davis,Solaris,2002,1722
Steve Carr,5.5,92 mins.,/title/tt0317303/,Two men get laid off and have to become stay-at-home dads when they can't find jobs. This inspires them to open their own day-care center. ,Eddie Murphy, Jeff Garlin, Anjelica Huston, Steve Zahn,Daddy Day Care,2003,1723
Lawrence Kasdan,5.5,136 mins.,/title/tt0285531/,Friends on a camping trip discover that the town they're vacationing in is being plagued in an unusual fashion by parasitic aliens from outer space. ,Morgan Freeman, Thomas Jane, Jason Lee, Damian Lewis,Dreamcatcher,2003,1724
David McNally,4.4,89 mins.,/title/tt0257568/,"Two childhood friends,  a New York hairstylist and a would-be musician,  get caught up with the mob and are forced to deliver $50, 000 to Australia,  but things go haywire when the money is lost to a wild kangaroo. ",Anthony Anderson, Jerry O'Connell, Estella Warren, Christopher Walken,Kangaroo Jack,2003,1725
Alan Parker,7.6,130 mins.,/title/tt0289992/,A man against capital punishment is accused of murdering a fellow activist and is sent to death row. ,Kevin Spacey, Kate Winslet, Laura Linney, Cleo King,The Life of David Gale,2003,1726
Ridley Scott,7.3,116 mins.,/title/tt0325805/,A phobic con artist and his protÕ©gÕ© are on the verge of pulling off a lucrative swindle when the former's teenage daughter arrives unexpectedly. ,Nicolas Cage, Alison Lohman, Sam Rockwell, Bruce Altman,Matchstick Men,2003,1727
David Zucker,4.6,86 mins.,/title/tt0270980/,"When a young man agrees to housesit for his boss,  he thinks it'll be the perfect opportunity to get close to the woman he desperately has a crush on... ",Ashton Kutcher, Tara Reid, Andy Richter, Molly Shannon,My Boss's Daughter,2003,1728
Kevin Costner,7.5,139 mins.,/title/tt0316356/,A former gunslinger is forced to take up arms again when he and his cattle crew are threatened by a corrupt lawman. ,Kevin Costner, Robert Duvall, Diego Luna, Abraham Benrubi,Open Range,2003,1729
David Dobkin,6.2,114 mins.,/title/tt0300471/,"When a Chinese rebel murders Chon's estranged father and escapes to England,  Chon and Roy make their way to London with revenge on their minds. ",Jackie Chan, Owen Wilson, Fann Wong, Aaron Taylor-Johnson,Shanghai Knights,2003,1730
Carl Franklin,6.5,105 mins.,/title/tt0313443/,A Florida police chief must solve a vicious double homicide before he himself falls under suspicion. ,Denzel Washington, Sanaa Lathan, Eva Mendes, Dean Cain,Out of Time,2003,1731
Frank Coraci,5.8,120 mins.,/title/tt0327437/,"To win a bet,  an eccentric British inventor beside his Chinese valet and an aspiring French artist,  embarks on a trip full of adventures and dangers around the world in exactly 80 days. ",Jackie Chan, Steve Coogan, Jim Broadbent, Kathy Bates,Around the World in 80 Days,2004,1732
Pitof,3.3,104 mins.,/title/tt0327554/,"A shy woman,  endowed with the speed,  reflexes,  and senses of a cat,  walks a thin line between criminal and hero,  even as a detective doggedly pursues her,  fascinated by both of her personas. ",Halle Berry, Sharon Stone, Benjamin Bratt, Lambert Wilson,Catwoman,2004,1733
Tommy O'Haver,6.3,96 mins.,/title/tt0327679/,"Ella is under a spell to be constantly obedient,  a fact she must hide from her new step-family in order to protect the prince of the land,  her friend for whom she's falling. ",Anne Hathaway, Hugh Dancy, Cary Elwes, Joanna Lumley,Ella Enchanted,2004,1734
Forest Whitaker,5,106 mins.,/title/tt0361620/,The first daughter of the U.S. President heads off to college where she falls for a graduate student with a secret agenda. ,Katie Holmes, Marc Blucas, Michael Keaton, Amerie,First Daughter,2004,1735
John Moore,6.1,113 mins.,/title/tt0377062/,Survivors of a plane crash in the Mongolian desert work together to build a new plane. ,Dennis Quaid, Miranda Otto, Giovanni Ribisi, Tyrese Gibson,Flight of the Phoenix,2004,1736
Sean McNamara,5.9,103 mins.,/title/tt0361696/,A girl from a small town heads to the big city of Los Angeles to spend the summer at a performing arts high school. ,Hilary Duff, John Corbett, Rebecca De Mornay, Oliver James,Raise Your Voice,2004,1737
Don Mancini,4.9,87 mins.,/title/tt0387575/,"Chucky and Tiffany are resurrected by their innocent son,  Glen,  and hit Hollywood,  where a movie depicting the killer dolls' murder spree is underway. ",Jennifer Tilly, Brad Dourif, John Waters, Billy Boyd,Seed of Chucky,2004,1738
Joe Nussbaum,5.3,89 mins.,/title/tt0368975/,"Four best friends,  desperate to improve their social status,  enter into an all-night scavenger hunt against the popular clique in their school. ",Alexa PenaVega, Mika Boorem, Scout Taylor-Compton, Jane Lynch,Sleepover,2004,1739
F. Gary Gray,5.7,118 mins.,/title/tt0377471/,"Disenchanted with the movie industry,  Chili Palmer tries the music industry,  meeting and romancing a widow of a music executive on the way. ",John Travolta, Uma Thurman, Dwayne Johnson, Vince Vaughn,Be Cool,2005,1740
John Polson,5.9,101 mins.,/title/tt0382077/,"As a widower tries to piece together his life in the wake of his wife's suicide,  his daughter finds solace -- at first -- in her imaginary friend. ",Robert De Niro, Dakota Fanning, Famke Janssen, Elisabeth Shue,Hide and Seek,2005,1741
Florent Siri,6.6,113 mins.,/title/tt0340163/,"A failed police negotiator turned small-town cop,  must save the lives of a family held hostage,  which draws him into a much more dangerous situation. ",Bruce Willis, Kevin Pollak, Serena Scott Thomas, Jimmy Bennett,Hostage,2005,1742
Sydney Pollack,6.4,128 mins.,/title/tt0373926/,"Political intrigue and deception unfold inside the United Nations,  where a U.S. Secret Service agent is assigned to investigate an interpreter who overhears an assassination plot. ",Nicole Kidman, Sean Penn, Catherine Keener, Jesper Christensen,The Interpreter,2005,1743
Robert Luketic,5.5,101 mins.,/title/tt0369735/,"The love life of Charlotte is reduced to an endless string of disastrous blind dates,  until she meets the perfect man,  Kevin. Unfortunately,  his merciless mother will do anything to destroy their relationship. ",Jennifer Lopez, Michael Vartan, Jane Fonda, Wanda Sykes,Monster-in-Law,2005,1744
Clare Kilner,6.1,90 mins.,/title/tt0372532/,"Single-girl anxiety causes Kat Ellis Messing to hire a male escort Mulroney to pose as her boyfriend at her sister's wedding. Her plan,  an attempt to dupe her ex-fiancÕ©,  who dumped her a couple years prior,  proves to be her undoing. ",Dermot Mulroney, Debra Messing, Jack Davenport, Amy Adams,The Wedding Date,2005,1745
Richard Linklater,5.8,113 mins.,/title/tt0408524/,A grizzled little league coach tries to turn his team of misfits into champs. ,Billy Bob Thornton, Greg Kinnear, Marcia Gay Harden, Sammi Kane Kraft,Bad News Bears,2005,1746
Lasse HallstrÕ_m,6.5,112 mins.,/title/tt0402894/,"Heath Ledger plays the fabled romantic as a man who,  after failing to win the affection of a particular Venetian woman,  strives to discover the real meaning of love. ",Heath Ledger, Sienna Miller, Jeremy Irons, Oliver Platt,Casanova,2005,1747
Dean Parisot,6.1,90 mins.,/title/tt0369441/,"When an affluent couple lose all their money following a series of blunders,  they turn to a life of crime to make ends meet. ",Jim Carrey, TÕ©a Leoni, Alec Baldwin, Richard Jenkins,Fun with Dick and Jane,2005,1748
Martin Campbell,5.9,129 mins.,/title/tt0386140/,"Despite trying to keep his swashbuckling to a minimum,  a threat to California's pending statehood causes the adventure-loving Alejandro de la Vega Banderas -- and his wife,  Elena Zeta-Jones -- to take action. ",Antonio Banderas, Catherine Zeta-Jones, Rufus Sewell, Alberto Reyes,The Legend of Zorro,2005,1749
Susan Stroman,6.4,134 mins.,/title/tt0395251/,"After putting together another Broadway flop,  down-on-his-luck producer Max Bialystock teams up with timid accountant Leo Bloom in a get-rich-quick scheme to put on the world's worst show. ",Nathan Lane, Matthew Broderick, Uma Thurman, Will Ferrell,The Producers,2005,1750
Rob Cohen,5,121 mins.,/title/tt0382992/,"Deeply ensconced in a top-secret military program,  three pilots struggle to bring an artificial intelligence program under control before it initiates the next world war. ",Josh Lucas, Jessica Biel, Jamie Foxx, Sam Shepard,Stealth,2005,1751
Steve Box,7.5,85 mins.,/title/tt0312004/,"Wallace and his loyal dog,  Gromit,  set out to discover the mystery behind the garden sabotage that plagues their village and threatens the annual giant vegetable growing contest. ",Peter Sallis, Helena Bonham Carter, Ralph Fiennes, Peter Kay,The Curse of the Were-Rabbit,2005,1752
Richard Donner,6.6,102 mins.,/title/tt0450232/,"An aging alcoholic cop is assigned the task of escorting a witness from police custody to a courthouse 16 blocks away. There are,  however,  chaotic forces at work that prevent them from making it in one piece. ",Bruce Willis, Yasiin Bey, David Morse, Jenna Stern,16 Blocks,2006,1753
Richard Loncraine,5.8,105 mins.,/title/tt0408345/,"A security specialist is forced into robbing the bank that he's protecting,  as a bid to pay off his family's ransom. ",Harrison Ford, Virginia Madsen, Paul Bettany, Carly Schroeder,Firewall,2006,1754
Phil Joanou,6.9,125 mins.,/title/tt0421206/,"Teenagers at a juvenile detention center,  under the leadership of their counselor,  gain self-esteem by playing football together. ",Dwayne Johnson, Xzibit, L. Scott Caldwell, Leon Rippy,Gridiron Gang,2006,1755
Tony Goldwyn,6.5,115 mins.,/title/tt0434139/,"Michael and Jenna,  having been a couple for three years,  want to get married and start a family. These... ",Zach Braff, Jacinda Barrett, Rachel Bilson, Casey Affleck,The Last Kiss,2006,1756
Shawn Levy,5.6,93 mins.,/title/tt0383216/,Bumbling Inspector Clouseau must solve the murder of a famous soccer coach and find out who stole the infamous Pink Panther diamond. ,Steve Martin, Kevin Kline, Jean Reno, Emily Mortimer,The Pink Panther,2006,1757
Jessica Bendinger,6.4,103 mins.,/title/tt0430634/,"After a run-in with the law,  Haley Graham ",Missy Peregrym, Jeff Bridges, Vanessa Lengies, Nikki SooHoo,Stick It,2006,1758
Pedro AlmodÕ_var,7.6,121 mins.,/title/tt0441909/,"After her death,  a mother returns to her home town in order to fix the situations she couldn't resolve during her life. ",PenÕ©lope Cruz, Carmen Maura, Lola DueÕ±as, Blanca Portillo,Volver,2006,1759
Simon West,5,87 mins.,/title/tt0455857/,"During a babysitting gig,  a high-school student is harassed by an increasingly threatening prank caller. ",Camilla Belle, Tommy Flanagan, Katie Cassidy, Tessa Thompson,When a Stranger Calls,2006,1760
Neil Labute,3.7,102 mins.,/title/tt0450345/,"A sheriff investigating the disappearance of a young girl from a small island discovers there's a larger mystery to solve among the island's secretive,  neo-pagan community. ",Nicolas Cage, Ellen Burstyn, Leelee Sobieski, Kate Beahan,The Wicker Man,2006,1761
Oliver Stone,6,129 mins.,/title/tt0469641/,Two Port Authority police officers become trapped under the rubble of the World Trade Center. ,Nicolas Cage, Michael PeÕ±a, Maria Bello, Maggie Gyllenhaal,World Trade Center,2006,1762
Richard Eyre,7.4,92 mins.,/title/tt0465551/,"A veteran high school teacher befriends a younger art teacher,  who is having an affair with one of her 15-year-old students. However,  her intentions with this new ""friend"" also go well beyond platonic friendship. ",Cate Blanchett, Judi Dench, Andrew Simpson, Tom Georgeson,Notes on a Scandal,2006,1763
Oliver Hirschbiegel,5.9,99 mins.,/title/tt0427392/,"As a Washington psychiatrist unearths the origin of an alien epidemic,  she also discovers her son might be the only way it can be stopped. ",Nicole Kidman, Daniel Craig, Jeremy Northam, Jackson Bond,The Invasion,2007,1764
Marc Lawrence,6.5,96 mins.,/title/tt0758766/,"A washed up singer is given a couple days to compose a chart-topping hit for an aspiring teen sensation. Though he's never written a decent lyric in his life,  he sparks with an offbeat younger woman with a flair for words. ",Hugh Grant, Drew Barrymore, Scott Porter, Nick Bacon,Music and Lyrics,2007,1765
James Foley,5.7,109 mins.,/title/tt0457433/,"A journalist goes undercover to ferret out businessman Harrison Hill as her childhood friend's killer. Posing as one of his temps,  she enters into a game of online cat-and-mouse. ",Halle Berry, Bruce Willis, Giovanni Ribisi, Richard Portnow,Perfect Stranger,2007,1766
Sylvain White,5.3,109 mins.,/title/tt0775539/,"After the death of his brother,  An expert street dancer goes to Georgia to attend Truth University.... ",Columbus Short, Meagan Good, Ne-Yo, Darrin Dewitt Henson,Stomp the Yard,2007,1767
Kevin Munroe,6.3,87 mins.,/title/tt0453556/,"When the world is threatened by an ancient evil,  the four adolescent turtles must reunite and overcome their faults in order to stand against it. ",Patrick Stewart, Mako, Chris Evans, Sarah Michelle Gellar,TMNT,2007,1768
NimrÕ_d Antal,6.2,85 mins.,/title/tt0452702/,"A married couple becomes stranded at an isolated motel and finds hidden video cameras in their room. They soon realize that unless they escape,  they'll be the next victims of a snuff film. ",Kate Beckinsale, Luke Wilson, Frank Whaley, Ethan Embry,Vacancy,2007,1769
David Moreau,5.4,98 mins.,/title/tt0406759/,A woman receives an eye transplant that allows her to see into the supernatural world. ,Jessica Alba, Alessandro Nivola, Parker Posey, Rade Serbedzija,The Eye,2008,1770
Jeff Lowell,5.2,95 mins.,/title/tt0785007/,A ghost tries to sabotage her former boyfriend's current relationship with a psychic. ,Eva Longoria, Paul Rudd, Lake Bell, Jason Biggs,Over Her Dead Body,2008,1771
Mark Palansky,6.8,104 mins.,/title/tt0472160/,"A modern romantic tale about a young aristocratic heiress born under a curse that can only be broken when she finds true love with ""one who will love her faithfully."" ",Christina Ricci, James McAvoy, Reese Witherspoon, Richard E. Grant,Penelope,2006,1772
Christine Jeffs,6.9,91 mins.,/title/tt0862846/,"In order to raise the tuition to send her young son to private school,  a mom starts an unusual business -- a biohazard removal/crime scene clean-up service -- with her unreliable sister. ",Amy Adams, Emily Blunt, Alan Arkin, Jason Spevack,Sunshine Cleaning,2008,1773
Michael McCullers,6,99 mins.,/title/tt0871426/,"A successful,  single businesswoman who dreams of having a baby discovers she is infertile and hires a working class woman to be her unlikely surrogate. ",Tina Fey, Amy Poehler, Sigourney Weaver, Greg Kinnear,Baby Mama,2008,1774
The Pang Brothers,5.4,99 mins.,/title/tt0814022/,A hitman who's in Bangkok to pull off a series of jobs violates his personal code when he falls for a local woman and bonds with his errand boy. ,Nicolas Cage, Charlie Yeung, Shahkrit Yamnarm, Panward Hemmanee,Bangkok Dangerous,2008,1775
Marcel Langenegger,6.1,107 mins.,/title/tt0800240/,"An accountant is introduced to a mysterious sex club known as The List by his lawyer friend. But in this new world,  he soon becomes the prime suspect in a woman's disappearance and a multi-million dollar heist. ",Hugh Jackman, Ewan McGregor, Michelle Williams, Bruce Altman,Deception,2008,1776
Gavin O'Connor,6.7,130 mins.,/title/tt0482572/,"A family's moral codes are tested when Ray Tierney investigates a case that reveals an incendiary police corruption scandal involving his own brother-in-law. For Ray,  the truth is revelatory,  a Pandora's Box that threatens to upend not only the Tierney legacy but the entire NYPD. ",Edward Norton, Colin Farrell, Noah Emmerich, Jon Voight,Pride and Glory,2008,1777
Peter Cattaneo,6.2,102 mins.,/title/tt1031969/,"The Rocker tells the story of a failed drummer who is given a second chance at fame. Robert ""Fish"" Fishman... ",Rainn Wilson, Josh Gad, Christina Applegate, Teddy Geiger,The Rocker,2008,1778
David Schwimmer,6.6,100 mins.,/title/tt0425413/,"Five years after jilting his pregnant fiancÕ©e on their wedding day,  out-of-shape Dennis decides to run a marathon to win her back. ",Simon Pegg, Thandie Newton, Hank Azaria, Dylan Moran,"Run,  Fatboy,  Run",2007,1779
Craig Mazin,4.5,75 mins.,/title/tt0426592/,"Orphaned high school student Rick Riker is bitten by a radioactive dragonfly,  develops super powers except for the ability to fly,  and becomes a hero. ",Drake Bell, Leslie Nielsen, Sara Paxton, Christopher McDonald,Superhero Movie,2008,1780
Diane English,4.9,114 mins.,/title/tt0430770/,"A wealthy New Yorker wrestles with the decision to leave her cheating husband,  as she and her friends discover that women really can have it all. ",Meg Ryan, Eva Mendes, Annette Bening, Debra Messing,The Women,2008,1781
Tony Gilroy,6.2,125 mins.,/title/tt1135487/,"Two ex-government agents turned rival industrial spies have to be at the top of their game when one of their companies prepares to launch a major product. However,  they distract each other in more ways than one. ",Julia Roberts, Clive Owen, Tom Wilkinson, Paul Giamatti,Duplicity,2009,1782
Dito Montiel,5.6,105 mins.,/title/tt1082601/,"In New York City,  a young counterfeiter is introduced to the world of underground street fighting by a seasoned scam artist,  who becomes his manager on the bare-knuckling brawling circuit. ",Channing Tatum, Terrence Howard, Luis GuzmÕçn, Zulay Henao,Fighting,2009,1783
Dominic Sena,5.5,101 mins.,/title/tt0365929/,"U.S. Marshal Carrie Stetko tracks a killer in Antarctica,  as the sun is about to set for six months. ",Kate Beckinsale, Gabriel Macht, Tom Skerritt, Columbus Short,Whiteout,2009,1784
Kevin Greutert,6,90 mins.,/title/tt1233227/,"Agent Strahm is dead,  and FBI agent Erickson draws nearer to Hoffman. Meanwhile,  a pair of insurance executives find themselves in another game set by Jigsaw. ",Tobin Bell, Costas Mandylor, Mark Rolston, Betsy Russell,Saw VI,2009,1785
Susanna White,6.1,109 mins.,/title/tt1415283/,"Nanny McPhee arrives to help a harried young mother who is trying to run the family farm while her husband is away at war,  though she uses her magic to teach the woman's children and their two spoiled cousins five new lessons. ",Emma Thompson, Maggie Gyllenhaal, Ralph Fiennes, Oscar Steer,Nanny McPhee Returns,2010,1786
Elizabeth Allen,6.7,103 mins.,/title/tt0493949/,"An adventurous young girl uses her imagination to escape her reality,  that is quickly spinning out of reach. ",Joey King, Selena Gomez, Bridget Moynahan, John Corbett,Ramona and Beezus,2010,1787
David Bowers,6.6,99 mins.,/title/tt1650043/,"Back in middle school after summer vacation,  Greg Heffley and his older brother Rodrick must deal with their parents' misguided attempts to have them bond. ",Zachary Gordon, Devon Bostick, Robert Capron, Rachael Harris,Diary of a Wimpy Kid: Rodrick Rules,2011,1788
Doug McGrath,4.9,89 mins.,/title/tt1742650/,"A comedy centered on the life of Kate Reddy,  a finance executive who is the breadwinner for her husband and two kids. ",Sarah Jessica Parker, Pierce Brosnan, Kelsey Grammer, Greg Kinnear,I Don't Know How She Does It,2011,1789
