director,user_rating,runtime,link,description,star1,star2,star3,star4,title,year,rank
Quentin Tarantino,8.9,154 mins.,/title/tt0110912/,"The lives of two mob hit men,  a boxer,  a gangster's wife,  and a pair of diner bandits intertwine in four tales of violence and redemption. ",John Travolta, Uma Thurman, Samuel L. Jackson, Bruce Willis,Pulp Fiction,1994,1
Marc Webb,6.7,142 mins.,/title/tt1872181/,"When New York is put under siege by Oscorp,  it is up to Spider-Man to save the city he swore to protect as well as his loved ones. ",Andrew Garfield, Emma Stone, Jamie Foxx, Paul Giamatti,The Amazing Spider-Man 2,2014,2
Frank Darabont,9.3,142 mins.,/title/tt0111161/,"Two imprisoned men bond over a number of years,  finding solace and eventual redemption through acts of common decency. ",Tim Robbins, Morgan Freeman, Bob Gunton, William Sadler,The Shawshank Redemption,1994,3
George Lucas,8.7,121 mins.,/title/tt0076759/,"Luke Skywalker joins forces with a Jedi Knight,  a cocky pilot,  a wookiee and two droids to save the galaxy from the Empire's world-destroying battle-station,  while also attempting to rescue Princess Leia from the evil Darth Vader. ",Mark Hamill, Harrison Ford, Carrie Fisher, Alec Guinness,Star Wars: Episode IV - A New Hope,1977,4
Robert Zemeckis,8.5,116 mins.,/title/tt0088763/,"Marty McFly,  a 17-year-old high school student,  is accidentally sent 30 years into the past in a time-traveling DeLorean invented by his close friend,  the maverick scientist Doc Brown. ",Michael J. Fox, Christopher Lloyd, Lea Thompson, Crispin Glover,Back to the Future,1985,5
John Hughes,7.9,97 mins.,/title/tt0088847/,Five high school students meet in Saturday detention and discover how they have a lot more in common than they thought. ,Emilio Estevez, Judd Nelson, Molly Ringwald, Ally Sheedy,The Breakfast Club,1985,6
Richard Donner,7.8,114 mins.,/title/tt0089218/,"In order to save their home from foreclosure,  a group of misfits set out to find a pirate's ancient valuable treasure. ",Sean Astin, Josh Brolin, Jeff Cohen, Corey Feldman,The Goonies,1985,7
Jonathan Demme,8.6,118 mins.,/title/tt0102926/,A young F.B.I. cadet must confide in an incarcerated and manipulative killer to receive his help on catching another serial killer who skins his victims. ,Jodie Foster, Anthony Hopkins, Lawrence A. Bonney, Kasi Lemmons,The Silence of the Lambs,1991,8
Steven Spielberg,8.1,127 mins.,/title/tt0107290/,"During a preview tour,  a theme park suffers a major power breakdown that allows its cloned dinosaur exhibits to run amok. ",Sam Neill, Laura Dern, Jeff Goldblum, Richard Attenborough,Jurassic Park,1993,9
Roger Allers,8.5,88 mins.,/title/tt0110357/,Lion cub and future king Simba searches for his identity. His eagerness to please others and penchant for testing his boundaries sometimes gets him into trouble. ,Matthew Broderick, Jeremy Irons, James Earl Jones, Whoopi Goldberg,The Lion King,1994,10
David Fincher,8.6,127 mins.,/title/tt0114369/,"Two detectives,  a rookie and a veteran,  hunt a serial killer who uses the seven deadly sins as his modus operandi. ",Morgan Freeman, Brad Pitt, Kevin Spacey, Andrew Kevin Walker,Se7en,1995,11
John Lasseter,8.3,81 mins.,/title/tt0114709/,A cowboy doll is profoundly threatened and jealous when a new spaceman figure supplants him as top toy in a boy's room. ,Tom Hanks, Tim Allen, Don Rickles, Jim Varney,Toy Story,1995,12
Joel Coen,8.2,117 mins.,/title/tt0118715/,"""The Dude"" Lebowski,  mistaken for a millionaire Lebowski,  seeks restitution for his ruined rug and enlists his bowling buddies to help get it. ",Jeff Bridges, John Goodman, Julianne Moore, Steve Buscemi,The Big Lebowski,1998,13
Steven Spielberg,8.6,169 mins.,/title/tt0120815/,"Following the Normandy Landings,  a group of U.S. soldiers go behind enemy lines to retrieve a paratrooper whose brothers have been killed in action. ",Tom Hanks, Matt Damon, Tom Sizemore, Edward Burns,Saving Private Ryan,1998,14
David Fincher,8.8,139 mins.,/title/tt0137523/,"An insomniac office worker,  looking for a way to change his life,  crosses paths with a devil-may-care soap maker,  forming an underground fight club that evolves into something much,  much more. ",Brad Pitt, Edward Norton, Meat Loaf, Zach Grenier,Fight Club,1999,15
The Wachowski Brothers,8.7,136 mins.,/title/tt0133093/,A computer hacker learns from mysterious rebels about the true nature of his reality and his role in the war against its controllers. ,Keanu Reeves, Laurence Fishburne, Carrie-Anne Moss, Hugo Weaving,The Matrix,1999,16
George Lucas,6.5,136 mins.,/title/tt0120915/,"Two Jedi Knights escape a hostile blockade to find allies and come across a young boy who may bring balance to the Force,  but the long dormant Sith resurface to reclaim their old glory. ",Ewan McGregor, Liam Neeson, Natalie Portman, Jake Lloyd,Star Wars: Episode I - The Phantom Menace,1999,17
Ridley Scott,8.5,155 mins.,/title/tt0172495/,"When a Roman general is betrayed and his family murdered by an emperor's corrupt son,  he comes to Rome as a gladiator to seek revenge. ",Russell Crowe, Joaquin Phoenix, Connie Nielsen, Oliver Reed,Gladiator,2000,18
Bryan Singer,7.4,104 mins.,/title/tt0120903/,Two mutants come to a private academy for their kind whose resident superhero team must oppose a terrorist organization with similar powers. ,Patrick Stewart, Hugh Jackman, Ian McKellen, Famke Janssen,X-Men,2000,19
Chris Columbus,7.5,152 mins.,/title/tt0241527/,"Rescued from the outrageous neglect of his aunt and uncle,  a young boy with a great destiny proves his worth while attending Hogwarts School of Witchcraft and Wizardry. ",Daniel Radcliffe, Rupert Grint, Richard Harris, Maggie Smith,Harry Potter and the Sorcerer's Stone,2001,20
Peter Jackson,8.8,178 mins.,/title/tt0120737/,A meek Hobbit from the Shire and eight companions set out on a journey to destroy the powerful One Ring and save Middle Earth from the Dark Lord Sauron. ,Elijah Wood, Ian McKellen, Orlando Bloom, Sean Bean,The Lord of the Rings: The Fellowship of the Ring,2001,21
Peter Jackson,8.7,179 mins.,/title/tt0167261/,"While Frodo and Sam edge closer to Mordor with the help of the shifty Gollum,  the divided fellowship makes a stand against Sauron's new ally,  Saruman,  and his hordes of Isengard. ",Elijah Wood, Ian McKellen, Viggo Mortensen, Orlando Bloom,The Lord of the Rings: The Two Towers,2002,22
Rob Cohen,5.8,124 mins.,/title/tt0295701/,"An extreme sports athlete,  Xander Cage,  is recruited by the government on a special mission. ",Vin Diesel, Asia Argento, Marton Csokas, Samuel L. Jackson,xXx,2002,23
Andrew Stanton,8.1,100 mins.,/title/tt0266543/,"After his son is captured in the Great Barrier Reef and taken to Sydney,  a timid clownfish sets out on a journey to bring him home. ",Albert Brooks, Ellen DeGeneres, Alexander Gould, Willem Dafoe,Finding Nemo,2003,24
Peter Jackson,8.9,201 mins.,/title/tt0167260/,Gandalf and Aragorn lead the World of Men against Sauron's army to draw his gaze from Frodo and Sam as they approach Mount Doom with the One Ring. ,Elijah Wood, Viggo Mortensen, Ian McKellen, Orlando Bloom,The Lord of the Rings: The Return of the King,2003,25
Adam McKay,7.2,94 mins.,/title/tt0357413/,"Ron Burgundy is San Diego's top-rated newsman in the male-dominated broadcasting of the 1970s,  but that's all about to change for Ron and his cronies when an ambitious woman is hired as a new anchor. ",Will Ferrell, Christina Applegate, Steve Carell, Paul Rudd,Anchorman: The Legend of Ron Burgundy,2004,26
Mark Waters,7,97 mins.,/title/tt0377092/,"Cady Heron is a hit with The Plastics,  the A-list girl clique at her new school,  until she makes the mistake of falling for Aaron Samuels,  the ex-boyfriend of alpha Plastic Regina George. ",Lindsay Lohan, Jonathan Bennett, Rachel McAdams, Tina Fey,Mean Girls,2004,27
Frank Miller,8,124 mins.,/title/tt0401792/,"A film that explores the dark and miserable town,  Basin City,  and tells the story of three different people,  all caught up in violent corruption. ",Mickey Rourke, Clive Owen, Bruce Willis, Jessica Alba,Sin City,2005,28
George Lucas,7.6,140 mins.,/title/tt0121766/,"Three years into the Clone Wars,  the Jedi rescue Palpatine from Count Dooku. As Obi-Wan pursues a new threat,  Anakin acts as a double agent between the Jedi Council and Palpatine and is lured into a sinister plan to rule the galaxy. ",Hayden Christensen, Natalie Portman, Ewan McGregor, Samuel L. Jackson,Star Wars: Episode III - Revenge of the Sith,2005,29
Christopher Nolan,8.3,140 mins.,/title/tt0372784/,"After training with his mentor,  Batman begins his fight to free crime-ridden Gotham City from the corruption that Scarecrow and the League of Shadows have cast upon it. ",Christian Bale, Michael Caine, Ken Watanabe, Liam Neeson,Batman Begins,2005,30
Martin Scorsese,8.5,151 mins.,/title/tt0407887/,An undercover cop and a mole in the police attempt to identify each other while infiltrating an Irish gang in South Boston. ,Leonardo DiCaprio, Matt Damon, Jack Nicholson, Mark Wahlberg,The Departed,2006,31
Christopher Nolan,8.5,130 mins.,/title/tt0482571/,Two stage magicians engage in competitive one-upmanship in an attempt to create the ultimate stage illusion. ,Christian Bale, Hugh Jackman, Scarlett Johansson, Michael Caine,The Prestige,2006,32
James McTeigue,8.2,132 mins.,/title/tt0434409/,"In a future British tyranny,  a shadowy freedom fighter,  known only by the alias of ""V"",  plots to overthrow it with the help of a young woman. ",Hugo Weaving, Natalie Portman, Rupert Graves, Stephen Rea,V for Vendetta,2005,33
Martin Campbell,8,144 mins.,/title/tt0381061/,"Armed with a licence to kill,  Secret Agent James Bond sets out on his first mission as 007 and must defeat a weapons dealer in a high stakes game of poker at Casino Royale,  but things are not what they seem. ",Daniel Craig, Eva Green, Judi Dench, Jeffrey Wright,Casino Royale,2006,34
Michael Bay,7.1,144 mins.,/title/tt0418279/,"An ancient struggle between two Cybertronian races,  the heroic Autobots and the evil Decepticons,  comes to Earth,  with a clue to the ultimate power held by a teenager. ",Shia LaBeouf, Megan Fox, Josh Duhamel, Tyrese Gibson,Transformers,2007,35
Christopher Nolan,9,152 mins.,/title/tt0468569/,"When the menace known as the Joker wreaks havoc and chaos on the people of Gotham,  the caped crusader must come to terms with one of the greatest psychological tests of his ability to fight injustice. ",Christian Bale, Heath Ledger, Aaron Eckhart, Michael Caine,The Dark Knight,2008,36
Jon Favreau,7.9,126 mins.,/title/tt0371746/,"After being held captive in an Afghan cave,  billionaire engineer Tony Stark creates a unique weaponized suit of armor to fight evil. ",Robert Downey Jr., Gwyneth Paltrow, Terrence Howard, Jeff Bridges,Iron Man,2008,37
Marc Forster,6.6,106 mins.,/title/tt0830515/,"James Bond descends into mystery as he tries to stop a mysterious organization from eliminating a country's most valuable resource. All the while,  he still tries to seek revenge over the death of his love. ",Daniel Craig, Olga Kurylenko, Mathieu Amalric, Judi Dench,Quantum of Solace,2008,38
Ben Stiller,7,107 mins.,/title/tt0942385/,"Through a series of freak occurrences,  a group of actors shooting a big-budget war movie are forced to become the soldiers they are portraying. ",Ben Stiller, Jack Black, Robert Downey Jr., Jeff Kahn,Tropic Thunder,2008,39
Stephen Sommers,5.8,118 mins.,/title/tt1046173/,"An elite military unit comprised of special operatives known as G.I. Joe,  operating out of The Pit,  takes on an evil organization led by a notorious arms dealer. ",Dennis Quaid, Channing Tatum, Marlon Wayans, Adewale Akinnuoye-Agbaje,G.I. Joe: The Rise of Cobra,2009,40
Todd Phillips,7.8,100 mins.,/title/tt1119646/,"Three buddies wake up from a bachelor party in Las Vegas,  with no memory of the previous night and the bachelor missing. They make their way around the city in order to find their friend before his wedding. ",Zach Galifianakis, Bradley Cooper, Justin Bartha, Ed Helms,The Hangover,2009,41
Quentin Tarantino,8.3,153 mins.,/title/tt0361748/,"In Nazi-occupied France during World War II,  a plan to assassinate Nazi leaders by a group of Jewish U.S. soldiers coincides with a theatre owner's vengeful plans for the same. ",Brad Pitt, Diane Kruger, Eli Roth, MÕ©lanie Laurent,Inglourious Basterds,2009,42
J.J. Abrams,8,127 mins.,/title/tt0796366/,The brash James T. Kirk tries to live up to his father's legacy with Mr. Spock keeping him in check as a vengeful Romulan from the future creates black holes to destroy the Federation one planet at a time. ,Chris Pine, Zachary Quinto, Simon Pegg, Leonard Nimoy,Star Trek,2009,43
Pierre Morel,7.8,93 mins.,/title/tt0936501/,"A retired CIA agent travels across Europe and relies on his old skills to save his estranged daughter,  who has been kidnapped while on a trip to Paris. ",Liam Neeson, Maggie Grace, Famke Janssen, Leland Orser,Taken,2008,44
Pete Docter,8.3,96 mins.,/title/tt1049413/,"Seventy-eight year old Carl Fredricksen travels to Paradise Falls in his home equipped with balloons,  inadvertently taking a young stowaway. ",Edward Asner, Jordan Nagai, John Ratzenberger, Christopher Plummer,Up,2009,45
Gavin Hood,6.7,107 mins.,/title/tt0458525/,"A look at Wolverine's early life,  in particular his time with the government squad Team X and the impact it will have on his later years. ",Hugh Jackman, Liev Schreiber, Ryan Reynolds, Danny Huston,X-Men Origins: Wolverine,2009,46
Ruben Fleischer,7.7,88 mins.,/title/tt1156398/,"A shy student trying to reach his family in Ohio,  a gun-toting tough guy trying to find the last Twinkie,  and a pair of sisters trying to get to an amusement park join forces to travel across a zombie-filled America. ",Jesse Eisenberg, Emma Stone, Woody Harrelson, Abigail Breslin,Zombieland,2009,47
Roland Emmerich,5.8,158 mins.,/title/tt1190080/,A frustrated writer struggles to keep his family alive when a series of global catastrophes threatens to annihilate mankind. ,John Cusack, Thandie Newton, Chiwetel Ejiofor, Amanda Peet,2012,2009,48
James Cameron,7.9,162 mins.,/title/tt0499549/,A paraplegic marine dispatched to the moon Pandora on a unique mission becomes torn between following his orders and protecting the world he feels is his home. ,Sam Worthington, Zoe Saldana, Sigourney Weaver, Michelle Rodriguez,Avatar,2009,49
Pierre Coffin,7.7,95 mins.,/title/tt1323594/,"When a criminal mastermind uses a trio of orphan girls as pawns for a grand scheme,  he finds their love is profoundly changing him for the better. ",Steve Carell, Jason Segel, Russell Brand, Julie Andrews,Despicable Me,2010,50
Dennis Dugan,6,102 mins.,/title/tt1375670/,"After their high school basketball coach passes away,  five good friends and former teammates reunite for a Fourth of July holiday weekend. ",Adam Sandler, Salma Hayek, Kevin James, Chris Rock,Grown Ups,2010,51
Dean DeBlois,8.2,98 mins.,/title/tt0892769/,"A hapless young Viking who aspires to hunt dragons becomes the unlikely friend of a young dragon himself,  and learns there may be more to the creatures than he assumed. ",Jay Baruchel, Gerard Butler, Christopher Mintz-Plasse, Craig Ferguson,How to Train Your Dragon,2010,52
Christopher Nolan,8.8,148 mins.,/title/tt1375666/,"A thief,  who steals corporate secrets through use of dream-sharing technology,  is given the inverse task of planting an idea into the mind of a CEO. ",Leonardo DiCaprio, Joseph Gordon-Levitt, Ellen Page, Ken Watanabe,Inception,2010,53
Jon Favreau,7,124 mins.,/title/tt1228705/,"With the world now aware of his identity as Iron Man,  Tony Stark must contend with both his declining health and a vengeful mad man with ties to his father's legacy. ",Robert Downey Jr., Mickey Rourke, Gwyneth Paltrow, Don Cheadle,Iron Man 2,2010,54
Matthew Vaughn,7.7,117 mins.,/title/tt1250777/,"Dave Lizewski is an unnoticed high school student and comic book fan who one day decides to become a superhero,  even though he has no powers,  training or meaningful reason to do so. ",Aaron Taylor-Johnson, Nicolas Cage, ChloÕ‰ Grace Moretz, Garrett M. Brown,Kick-Ass,2010,55
Robert Schwentke,7.1,111 mins.,/title/tt1245526/,"When his peaceful life is threatened by a high-tech assassin,  former black-ops agent Frank Moses reassembles his old team in a last ditch effort to survive and uncover his assailants. ",Bruce Willis, Helen Mirren, Morgan Freeman, Mary-Louise Parker,RED,2010,56
Martin Scorsese,8.1,138 mins.,/title/tt1130884/,"In 1954,  a U.S. marshal investigates the disappearance of a murderess who escaped from a hospital for the criminally insane. ",Leonardo DiCaprio, Emily Mortimer, Mark Ruffalo, Ben Kingsley,Shutter Island,2010,57
Joseph Kosinski,6.8,125 mins.,/title/tt1104001/,The son of a virtual world designer goes looking for his father and ends up inside the digital world that his father designed. He meets his father's corrupted creation and a unique ally who was born inside the digital world. ,Jeff Bridges, Garrett Hedlund, Olivia Wilde, Bruce Boxleitner,TRON: Legacy,2010,58
Lee Unkrich,8.3,103 mins.,/title/tt0435761/,"The toys are mistakenly delivered to a day-care center instead of the attic right before Andy leaves for college,  and it's up to Woody to convince the other toys that they weren't abandoned and to return home. ",Tom Hanks, Tim Allen, Joan Cusack, Ned Beatty,Toy Story 3,2010,59
Nicolas Winding Refn,7.8,100 mins.,/title/tt0780504/,A mysterious Hollywood stuntman and mechanic moonlights as a getaway driver and finds himself in trouble when he helps out his neighbor. ,Ryan Gosling, Carey Mulligan, Bryan Cranston, Albert Brooks,Drive,2011,60
Justin Lin,7.3,131 mins.,/title/tt1596343/,Dominic Toretto and his crew of street racers plan a massive heist to buy their freedom while in the sights of a powerful Brazilian drug lord and a dangerous federal agent. ,Vin Diesel, Paul Walker, Dwayne Johnson, Jordana Brewster,Fast Five,2011,61
David Yates,8.1,130 mins.,/title/tt1201607/,"Harry,  Ron and Hermione search for Voldemort's remaining Horcruxes in their effort to destroy the Dark Lord as the final battle rages on at Hogwarts. ",Daniel Radcliffe, Emma Watson, Rupert Grint, Michael Gambon,Harry Potter and the Deathly Hallows: Part 2,2011,62
Neil Burger,7.4,105 mins.,/title/tt1219289/,"With the help of a mysterious pill that enables the user to access 100 percent of his brain abilities,  a struggling writer becomes a financial wizard,  but it also puts him in a new world with lots of dangers. ",Bradley Cooper, Anna Friel, Abbie Cornish, Robert De Niro,Limitless,2011,63
Rob Marshall,6.7,136 mins.,/title/tt1298650/,"Jack Sparrow and Barbossa embark on a quest to find the elusive fountain of youth,  only to discover that Blackbeard and his daughter are after it too. ",Johnny Depp, PenÕ©lope Cruz, Ian McShane, Geoffrey Rush,Pirates of the Caribbean: On Stranger Tides,2011,64
Matthew Vaughn,7.8,132 mins.,/title/tt1270798/,"In 1962,  the United States government enlists the help of Mutants with superhuman abilities to stop a malicious dictator who is determined to start World War III. ",James McAvoy, Michael Fassbender, Jennifer Lawrence, Kevin Bacon,X-Men: First Class,2011,65
David Fincher,7.8,158 mins.,/title/tt1568346/,"Journalist Mikael Blomkvist is aided in his search for a woman who has been missing for forty years by Lisbeth Salander,  a young computer hacker. ",Daniel Craig, Rooney Mara, Christopher Plummer, Stellan SkarsgÕ‚rd,The Girl with the Dragon Tattoo,2011,66
Tate Taylor,8.1,146 mins.,/title/tt1454029/,"An aspiring author during the civil rights movement of the 1960s decides to write a book detailing the African American maids' point of view on the white families for which they work,  and the hardships they go through on a daily basis. ",Emma Stone, Viola Davis, Octavia Spencer, Bryce Dallas Howard,The Help,2011,67
Andrew Niccol,6.7,109 mins.,/title/tt1637688/,"In a future where people stop aging at 25,  but are engineered to live only one more year,  having the means to buy your way out of the situation is a shot at immortal youth. Here,  Will Salas finds himself accused of murder and on the run with a hostage - a connection that becomes an important part of the way against the system. ",Justin Timberlake, Amanda Seyfried, Cillian Murphy, Olivia Wilde,In Time,2011,68
Phil Lord,7.2,110 mins.,/title/tt1232829/,A pair of underachieving cops are sent back to a local high school to blend in and bring down a synthetic drug ring. ,Jonah Hill, Channing Tatum, Ice Cube, Brie Larson,21 Jump Street,2012,69
Marc Webb,7,136 mins.,/title/tt0948470/,"After Peter Parker is bitten by a genetically altered spider,  he gains newfound,  spider-like powers and ventures out to solve the mystery of his parent's mysterious death. ",Andrew Garfield, Emma Stone, Rhys Ifans, Irrfan Khan,The Amazing Spider-Man,2012,70
Jon Hurwitz,6.7,113 mins.,/title/tt1605630/,"Jim,  Michelle,  Stifler,  and their friends reunite in East Great Falls,  Michigan for their high school reunion. ",Jason Biggs, Alyson Hannigan, Seann William Scott, Chris Klein,American Reunion,2012,71
Joss Whedon,8.1,143 mins.,/title/tt0848228/,Earth's mightiest heroes must come together and learn to fight as a team if they are to stop the mischievous Loki and his alien army from enslaving humanity. ,Robert Downey Jr., Chris Evans, Scarlett Johansson, Jeremy Renner,The Avengers,2012,72
Peter Berg,5.8,131 mins.,/title/tt1440129/,A fleet of ships is forced to do battle with an armada of unknown origins in order to discover and thwart their destructive goals. ,Alexander SkarsgÕ‚rd, Brooklyn Decker, Liam Neeson, Rihanna,Battleship,2012,73
Tony Gilroy,6.7,135 mins.,/title/tt1194173/,"An expansion of the universe from Robert Ludlum's novels,  centered on a new hero whose stakes have been triggered by the events of the previous three films. ",Jeremy Renner, Rachel Weisz, Edward Norton, Scott Glenn,The Bourne Legacy,2012,74
Mark Andrews,7.2,93 mins.,/title/tt1217209/,"Determined to make her own path in life,  Princess Merida defies a custom that brings chaos to her kingdom. Granted one wish,  Merida must rely on her bravery and her archery skills to undo a beastly curse. ",Kelly Macdonald, Billy Connolly, Emma Thompson, Julie Walters,Brave,2012,75
Drew Goddard,7,95 mins.,/title/tt1259521/,"Five friends go for a break at a remote cabin,  where they get more than they bargained for,  discovering the truth behind the cabin in the woods. ",Kristen Connolly, Chris Hemsworth, Anna Hutchison, Fran Kranz,The Cabin in the Woods,2012,76
Jay Roach,6.2,85 mins.,/title/tt1790886/,An incumbent congressman embroiled in personal scandal faces a no-holds-barred challenge from a naive newcomer funded by two unscrupulous billionaire lobbyist brothers. ,Will Ferrell, Zach Galifianakis, Jason Sudeikis, Dylan McDermott,The Campaign,2012,77
Tom Tykwer,7.5,172 mins.,/title/tt1371111/,"An exploration of how the actions of individual lives impact one another in the past,  present and future,  as one soul is shaped from a killer into a hero,  and an act of kindness ripples across centuries to inspire a revolution. ",Tom Hanks, Halle Berry, Hugh Grant, Hugo Weaving,Cloud Atlas,2012,78
Christopher Nolan,8.5,164 mins.,/title/tt1345836/,"Eight years after the Joker's reign of anarchy,  the Dark Knight,  with the help of the enigmatic Selina,  is forced from his imposed exile to save Gotham City,  now on the edge of total annihilation,  from the brutal guerrilla terrorist Bane. ",Christian Bale, Tom Hardy, Anne Hathaway, Gary Oldman,The Dark Knight Rises,2012,79
Tim Burton,6.2,113 mins.,/title/tt1077368/,"An imprisoned vampire,  Barnabas Collins,  is set free and returns to his ancestral home,  where his dysfunctional descendants are in need of his protection. ",Johnny Depp, Michelle Pfeiffer, Eva Green, Helena Bonham Carter,Dark Shadows,2012,80
Quentin Tarantino,8.4,165 mins.,/title/tt1853728/,"With the help of a German bounty hunter,  a freed slave sets out to rescue his wife from a brutal Mississippi plantation owner. ",Jamie Foxx, Christoph Waltz, Leonardo DiCaprio, Kerry Washington,Django Unchained,2012,81
Pete Travis,7.1,95 mins.,/title/tt1343727/,"In a violent,  futuristic city where the police have the authority to act as judge,  jury and executioner,  a cop teams with a trainee to take down a gang that deals the reality-altering drug,  SLO-MO. ",Karl Urban, Olivia Thirlby, Lena Headey, Rachel Wood,Dredd,2012,82
David Ayer,7.7,109 mins.,/title/tt1855199/,"Shot documentary-style,  this film follows the daily grind of two young police officers in LA who are partners and friends,  and what happens when they meet criminal forces greater than themselves. ",Jake Gyllenhaal, Michael PeÕ±a, Anna Kendrick, America Ferrera,End of Watch,2012,83
Simon West,6.6,103 mins.,/title/tt1764651/,"Mr. Church reunites the Expendables for what should be an easy paycheck,  but when one of their men is murdered on the job,  their quest for revenge puts them deep in enemy territory and up against an unexpected threat. ",Sylvester Stallone, Liam Hemsworth, Randy Couture, Jean-Claude Van Damme,The Expendables 2,2012,84
Robert Zemeckis,7.3,138 mins.,/title/tt1907668/,"An airline pilot saves almost all his passengers on his malfunctioning airliner which eventually crashed,  but an investigation into the accident reveals something troubling. ",Denzel Washington, Nadine Velazquez, Don Cheadle, John Goodman,Flight,2012,85
Anne Fletcher,5.8,95 mins.,/title/tt1694020/,"As inventor Andy Brewster is about to embark on the road trip of a lifetime,  a quick stop at his mom's house turns into an unexpected cross-country voyage with her along for the ride. ",Barbra Streisand, Seth Rogen, Julene Renee, Zabryna Guevara,The Guilt Trip,2012,86
