director,user_rating,runtime,link,description,star1,star2,star3,star4,title,year,rank
Brett Ratner,6,98 mins.,/title/tt1267297/,"Having endured his legendary twelve labors,  Hercules,  the Greek demigod,  has his life as a sword-for-hire tested when the King of Thrace and his daughter seek his aid in defeating a tyrannical warlord. ",Dwayne Johnson, John Hurt, Ian McShane, Joseph Fiennes,Hercules,2014,1058
Mel Brooks,8,106 mins.,/title/tt0072431/,"An American grandson of the infamous scientist,  struggling to prove that he is not as insane as people believe,  is invited to Transylvania,  where he discovers the process that reanimates a dead body. ",Gene Wilder, Madeline Kahn, Marty Feldman, Peter Boyle,Young Frankenstein,1974,1059
Wolfgang Reitherman,7.6,83 mins.,/title/tt0070608/,The story of the legendary outlaw is portrayed with the characters as humanoid animals. ,Brian Bedford, Phil Harris, Roger Miller, Peter Ustinov,Robin Hood,1973,1060
Sidney Lumet,8.1,121 mins.,/title/tt0074958/,A television network cynically exploits a deranged former anchor's ravings and revelations about the news media for its own profit. ,Faye Dunaway, William Holden, Peter Finch, Robert Duvall,Network,1976,1061
Steven Spielberg,7.7,137 mins.,/title/tt0075860/,"After an encounter with U.F.O.s,  a line worker feels undeniably drawn to an isolated area in the wilderness where something spectacular is about to happen. ",Richard Dreyfuss, FranÕ_ois Truffaut, Teri Garr, Melinda Dillon,Close Encounters of the Third Kind,1977,1062
Woody Allen,8.1,93 mins.,/title/tt0075686/,Neurotic New York comedian Alvy Singer falls in love with the ditzy Annie Hall. ,Woody Allen, Diane Keaton, Tony Roberts, Carol Kane,Annie Hall,1977,1063
Walter Hill,7.7,92 mins.,/title/tt0080120/,"In the near future,  a charismatic leader summons the street gangs of New York City in a bid to take it over. When he is killed,  The Warriors are falsely blamed and now must fight their way home while every other gang is hunting them down. ",Michael Beck, James Remar, Dorsey Wright, Brian Tyler,The Warriors,1979,1064
Lewis Gilbert,6.3,126 mins.,/title/tt0079574/,James Bond investigates the mid-air theft of a space shuttle and discovers a plot to commit global genocide. ,Roger Moore, Lois Chiles, Michael Lonsdale, Richard Kiel,Moonraker,1979,1065
John Milius,6.9,129 mins.,/title/tt0082198/,A barbarian warrior sets off to avenge his parents and his tribe whom were slain by an evil sorcerer and his henchmen when he was a boy. ,Arnold Schwarzenegger, James Earl Jones, Max von Sydow, Sandahl Bergman,Conan the Barbarian,1982,1066
Ted Kotcheff,7.7,93 mins.,/title/tt0083944/,"Former Green Beret John Rambo is pursued into the mountains surrounding a small town by a tyrannical sheriff and his deputies,  forcing him to survive using his combat skills. ",Sylvester Stallone, Brian Dennehy, Richard Crenna, Bill McKinney,First Blood,1982,1067
Patricia Birch,4.2,115 mins.,/title/tt0084021/,An English student at a 1960's American high school has to prove himself to the leader of a girls' gang whose members can only date greasers. ,Michelle Pfeiffer, Maxwell Caulfield, Lorna Luft, Maureen Teefy,Grease 2,1982,1068
Paul Brickman,6.8,99 mins.,/title/tt0086200/,"A Chicago teenager is looking for fun at home while his parents are away,  but the situation quickly gets out of hand. ",Tom Cruise, Rebecca De Mornay, Joe Pantoliano, Richard Masur,Risky Business,1983,1069
Steven Spielberg,7.8,154 mins.,/title/tt0088939/,A black Southern woman struggles to find her identity after suffering abuse from her father and others over four decades. ,Danny Glover, Whoopi Goldberg, Oprah Winfrey, Margaret Avery,The Color Purple,1985,1070
George P. Cosmatos,6.4,96 mins.,/title/tt0089880/,John Rambo is released from prison by the government for a top-secret covert mission to the last place on Earth he'd want to return - the jungles of Vietnam. ,Sylvester Stallone, Richard Crenna, Charles Napier, Steven Berkoff,Rambo: First Blood Part II,1985,1071
Sylvester Stallone,6.8,91 mins.,/title/tt0089927/,"After iron man Drago,  a highly intimidating 6-foot-5,  261-pound Soviet athlete,  kills Apollo Creed in an exhibition match,  Rocky comes to the heart of Russia for 15 pile-driving boxing rounds of revenge. ",Sylvester Stallone, Talia Shire, Burt Young, Carl Weathers,Rocky IV,1985,1072
Chris Columbus,6.9,102 mins.,/title/tt0092513/,A babysitter must battle her way through the big city after being stranded there with the kids she's looking after. ,Elisabeth Shue, Maia Brewton, Keith Coogan, Anthony Rapp,Adventures in Babysitting,1987,1073
John Hughes,7.6,93 mins.,/title/tt0093748/,A man must struggle to travel home for Thanksgiving with an obnoxious slob of a shower curtain ring salesman as his only companion. ,Steve Martin, John Candy, Laila Robins, Michael McKean,"Planes,  Trains & Automobiles",1987,1074
Paul Michael Glaser,6.6,101 mins.,/title/tt0093894/,A wrongly convicted man must try to survive a public execution gauntlet staged as a game show. ,Arnold Schwarzenegger, Maria Conchita Alonso, Yaphet Kotto, Jim Brown,The Running Man,1987,1075
Richard Donner,7.2,114 mins.,/title/tt0097733/,Riggs and Murtaugh are on the trail of South African diplomats who are using their immunity to engage in criminal activities. ,Mel Gibson, Danny Glover, Joe Pesci, Patsy Kensit,Lethal Weapon 2,1989,1076
Rowdy Herrington,6.5,114 mins.,/title/tt0098206/,A tough bouncer is hired to tame a dirty bar. ,Patrick Swayze, Kelly Lynch, Sam Elliott, Ben Gazzara,Road House,1989,1077
Herbert Ross,7.2,117 mins.,/title/tt0098384/,"A young beautician,  newly arrived in a small Louisiana town,  finds work at the local salon,  where a small group of women share a close bond of friendship and welcome her into the fold. ",Shirley MacLaine, Olympia Dukakis, Sally Field, Julia Roberts,Steel Magnolias,1989,1078
Ron Underwood,7.1,96 mins.,/title/tt0100814/,Natives of a small isolated town defend themselves against strange underground creatures which are killing them one by one. ,Kevin Bacon, Fred Ward, Finn Carter, Michael Gross,Tremors,1990,1079
John Singleton,7.8,112 mins.,/title/tt0101507/,"Follows the lives of three young males living in the Crenshaw ghetto of Los Angeles,  dissecting questions of race,  relationships,  violence and future prospects. ",Cuba Gooding Jr., Laurence Fishburne, Hudhail Al-Amir, Lloyd Avery II,Boyz n the Hood,1991,1080
Martin Scorsese,7.3,128 mins.,/title/tt0101540/,"A convicted rapist,  released from prison after serving a fourteen-year sentence,  stalks the family of the lawyer who originally defended him. ",Robert De Niro, Nick Nolte, Jessica Lange, Juliette Lewis,Cape Fear,1991,1081
Marco Brambilla,6.6,115 mins.,/title/tt0106697/,A police officer is brought out of suspended animation in prison to pursue an old ultra-violent nemesis who is loose in a non-violent future society. ,Sylvester Stallone, Wesley Snipes, Sandra Bullock, Nigel Hawthorne,Demolition Man,1993,1082
Jonathan Demme,7.7,125 mins.,/title/tt0107818/,"When a man with HIV is fired by his law firm because of his condition,  he hires a homophobic small time lawyer as the only willing advocate for a wrongful dismissal suit. ",Tom Hanks, Denzel Washington, Roberta Maxwell, Buzz Kilman,Philadelphia,1993,1083
Phillip Noyce,6.9,141 mins.,/title/tt0109444/,CIA Analyst Jack Ryan is drawn into an illegal war fought by the US government against a Colombian drug cartel. ,Harrison Ford, Willem Dafoe, Anne Archer, Joaquim de Almeida,Clear and Present Danger,1994,1084
Mike Newell,7.1,117 mins.,/title/tt0109831/,"Over the course of five social occasions,  a committed bachelor must consider the notion that he may have discovered love. ",Hugh Grant, Andie MacDowell, James Fleet, Simon Callow,Four Weddings and a Funeral,1994,1085
Brad Silberling,6,100 mins.,/title/tt0112642/,A paranormal expert and his daughter bunk in an abandoned house populated by three mischievous ghosts and one friendly one. ,Bill Pullman, Christina Ricci, Cathy Moriarty, Eric Idle,Casper,1995,1086
Robert Rodriguez,7.2,104 mins.,/title/tt0112851/,A gunslinger is embroiled in a war with a local drug runner. ,Antonio Banderas, Salma Hayek, Joaquim de Almeida, Cheech Marin,Desperado,1995,1087
Kevin Smith,7.2,94 mins.,/title/tt0113749/,"Both dumped by their girlfriends,  two best friends seek refuge in the local mall. ",Shannen Doherty, Jeremy London, Jason Lee, Claire Forlani,Mallrats,1995,1088
Paul Verhoeven,4.6,128 mins.,/title/tt0114436/,"Nomi,  a young drifter,  arrives in Las Vegas to become a dancer and soon sets about clawing and pushing her way to become the top of the Vegas showgirls. ",Elizabeth Berkley, Kyle MacLachlan, Gina Gershon, Glenn Plummer,Showgirls,1995,1089
Gary Trousdale,6.9,91 mins.,/title/tt0116583/,"A deformed bell-ringer must assert his independence from a vicious government minister in order to help his friend,  a gypsy dancer. ",Demi Moore, Jason Alexander, Tom Hulce, Mary Kay Bergman,The Hunchback of Notre Dame,1996,1090
Bobby Farrelly,6.9,113 mins.,/title/tt0116778/,"A star bowler whose career was prematurely ""cut off"" hopes to ride a new prodigy to success and riches. ",Woody Harrelson, Randy Quaid, Bill Murray, Vanessa Angel,Kingpin,1996,1091
Anthony Minghella,7.4,162 mins.,/title/tt0116209/,"At the close of WWII,  a young nurse tends to a badly-burned plane crash victim. His past is shown in flashbacks,  revealing an involvement in a fateful love affair. ",Ralph Fiennes, Juliette Binoche, Willem Dafoe, Kristin Scott Thomas,The English Patient,1996,1092
Wolfgang Petersen,6.4,124 mins.,/title/tt0118571/,"Hijackers seize the plane carrying the President of the United States and his family,  but he - an ex-soldier - works from hiding to defeat them. ",Harrison Ford, Gary Oldman, Glenn Close, Wendy Crewson,Air Force One,1997,1093
Jim Gillespie,5.6,101 mins.,/title/tt0119345/,"After a nasty accident,  four friends begin to drift apart. One year later Julie James gets a anonymous message and then a slicker wearing,  hook wielding killer begins to rip apart her life. ",Jennifer Love Hewitt, Sarah Michelle Gellar, Anne Heche, Ryan Phillippe,I Know What You Did Last Summer,1997,1094
Tamra Davis,6.7,82 mins.,/title/tt0120693/,The story of three not so bright men who come up with a series of crazy schemes to get a friend out of jail. ,Dave Chappelle, Guillermo DÕ_az, Jim Breuer, Harland Williams,Half Baked,1998,1095
John Dahl,7.4,121 mins.,/title/tt0128442/,A young man is a reformed gambler who must return to playing big stakes poker to help a friend pay off loan sharks. ,Matt Damon, Edward Norton, Gretchen Mol, John Malkovich,Rounders,1998,1096
John Madden,7.2,123 mins.,/title/tt0138097/,"A young Shakespeare,  out of ideas and short of cash,  meets his ideal woman and is inspired to write one of his most famous plays. ",Gwyneth Paltrow, Joseph Fiennes, Geoffrey Rush, Tom Wilkinson,Shakespeare in Love,1998,1097
Frank Coraci,6.1,90 mins.,/title/tt0120484/,A waterboy for a college football team discovers he has a unique tackling ability and becomes a member of the team. ,Adam Sandler, Kathy Bates, Henry Winkler, Fairuza Balk,The Waterboy,1998,1098
Vincent Ward,7,113 mins.,/title/tt0120889/,"After he dies in a car crash,  a man searches heaven and hell for his beloved wife. ",Robin Williams, Cuba Gooding Jr., Annabella Sciorra, Max von Sydow,What Dreams May Come,1998,1099
Oliver Stone,6.8,162 mins.,/title/tt0146838/,A behind-the-scenes look at the life-and-death struggles of modern-day gladiators and those who lead them. ,Al Pacino, Dennis Quaid, Cameron Diaz, James Woods,Any Given Sunday,1999,1100
Spike Jonze,7.8,112 mins.,/title/tt0120601/,A puppeteer discovers a portal that leads literally into the head of movie star ,John Cusack, Cameron Diaz, Catherine Keener, John Malkovich,Being John Malkovich,1999,1101
Dean Parisot,7.3,102 mins.,/title/tt0177789/,The alumni cast of a space opera television series have to play their roles as the real thing when an alien race needs their help. ,Tim Allen, Sigourney Weaver, Alan Rickman, Tony Shalhoub,Galaxy Quest,1999,1102
Stephen Frears,7.5,113 mins.,/title/tt0146882/,"Rob,  a record store owner and compulsive list maker,  recounts his top five breakups,  including the one in progress. ",John Cusack, Iben Hjejle, Todd Louiso, Jack Black,High Fidelity,2000,1103
Michael Cristofer,6,116 mins.,/title/tt0218922/,"A woman along with her lover,  plan to con a rich man by marrying him and on earning his trust running away with all his money. Everything goes as planned until she actually begins to fall in love with him. ",Antonio Banderas, Angelina Jolie, Thomas Jane, Jack Thompson,Original Sin,2001,1104
Brett Ratner,6.6,90 mins.,/title/tt0266915/,"Carter and Lee head to Hong Kong for vacation,  but become embroiled in a counterfeit money scam. ",Jackie Chan, Chris Tucker, John Lone, Ziyi Zhang,Rush Hour 2,2001,1105
Robert Rodriguez,5.4,88 mins.,/title/tt0227538/,The children of secret-agent parents must save them from danger. ,Alexa PenaVega, Daryl Sabara, Antonio Banderas, Carla Gugino,Spy Kids,2001,1106
Spike Lee,7.7,135 mins.,/title/tt0307901/,"Cornered by the DEA,  convicted New York drug dealer Montgomery Brogan reevaluates his life in the 24 remaining hours before facing a seven-year jail term. ",Edward Norton, Barry Pepper, Philip Seymour Hoffman, Rosario Dawson,25th Hour,2002,1107
Chris Weitz,7.1,101 mins.,/title/tt0276751/,"A cynical,  immature young man is taught how to act like a grown-up by a little boy. ",Hugh Grant, Nicholas Hoult, Toni Collette, Sharon Small,About a Boy,2002,1108
Spike Jonze,7.7,114 mins.,/title/tt0268126/,A lovelorn screenwriter becomes desperate as he tries and fails to adapt 'The Orchid Thief' by ,Nicolas Cage, Meryl Streep, Chris Cooper, Tilda Swinton,Adaptation.,2002,1109
Steven Brill,5.8,96 mins.,/title/tt0280590/,"A sweet-natured,  small-town guy inherits a controlling stake in a media conglomerate and begins to do business his way. ",Adam Sandler, Winona Ryder, John Turturro, Allen Covert,Mr. Deeds,2002,1110
Joel Zwick,6.6,95 mins.,/title/tt0259446/,A young Greek woman falls in love with a non-Greek and struggles to get her family to accept him while she comes to terms with her heritage and cultural identity. ,Nia Vardalos, John Corbett, Michael Constantine, Christina Eleusiniotis,My Big Fat Greek Wedding,2002,1111
Ron Clements,7.1,95 mins.,/title/tt0133240/,"A Disney animated version of ""Treasure Island"". The only difference is that the film is set in outer space with alien worlds and other galactic wonders. ",Joseph Gordon-Levitt, Emma Thompson, Martin Short, Roscoe Lee Browne,Treasure Planet,2002,1112
Mark Waters,6.1,97 mins.,/title/tt0322330/,"An overworked mother and her daughter do not get along. When they switch bodies,  each is forced to adapt to the other's life for one freaky Friday. ",Jamie Lee Curtis, Lindsay Lohan, Mark Harmon, Harold Gould,Freaky Friday,2003,1113
Rob Zombie,6,89 mins.,/title/tt0251736/,Two teenage couples traveling across the backwoods of Texas searching for urban legends of murder end up as prisoners of a bizarre and sadistic backwater family of serial killers. ,Sid Haig, Karen Black, Bill Moseley, Sheri Moon Zombie,House of 1000 Corpses,2003,1114
Roger Donaldson,6.6,115 mins.,/title/tt0292506/,A brilliant young CIA trainee is asked by his mentor to help find a mole in the Agency. ,Al Pacino, Colin Farrell, Bridget Moynahan, Gabriel Macht,The Recruit,2003,1115
Peter Berg,6.7,104 mins.,/title/tt0327850/,A tough aspiring chef is hired to bring home a mobster's son from the Amazon but becomes involved in the fight against an oppressive town operator and the search for a legendary treasure. ,Dwayne Johnson, Seann William Scott, Christopher Walken, Rosario Dawson,The Rundown,2003,1116
Antoine Fuqua,6.6,121 mins.,/title/tt0314353/,A Special-Ops commander leads his team into the Nigerian jungle in order to rescue a doctor who will only join them if they agree to save 70 refugees too. ,Bruce Willis, Cole Hauser, Monica Bellucci, Eamonn Walker,Tears of the Sun,2003,1117
Bo Welch,3.8,82 mins.,/title/tt0312528/,Two bored children have their lives turned upside down when a talking cat comes to visit them. ,Mike Myers, Spencer Breslin, Dakota Fanning, Alec Baldwin,The Cat in the Hat,2003,1118
Nancy Meyers,6.7,128 mins.,/title/tt0337741/,A swinger on the cusp of being a senior citizen with a taste for young women falls in love with an accomplished woman closer to his age. ,Jack Nicholson, Diane Keaton, Keanu Reeves, Amanda Peet,Something's Gotta Give,2003,1119
John Hamburg,5.9,90 mins.,/title/tt0343135/,A buttoned up newlywed finds his too organized life falling into chaos when he falls in love with an old classmate. ,Ben Stiller, Jennifer Aniston, Debra Messing, Philip Seymour Hoffman,Along Came Polly,2004,1120
Andy Cadiff,6.1,101 mins.,/title/tt0360139/,"Anna Foster has never had an ordinary life. At eighteen years old,  she is the most protected girl in America; she is the First Daughter... ",Mandy Moore, Matthew Goode, Mark Harmon, Stark Sands,Chasing Liberty,2004,1121
David R. Ellis,6.5,94 mins.,/title/tt0337921/,A young man receives an emergency phone call on his cell phone from an older woman. The catch? The woman claims to have been kidnapped; and the kidnappers have targeted her husband and child next. ,Kim Basinger, Chris Evans, Jason Statham, William H. Macy,Cellular,2004,1122
Takashi Shimizu,5.9,91 mins.,/title/tt0391198/,"An American nurse living and working in Tokyo is exposed to a mysterious supernatural curse,  one that locks a person in a powerful rage before claiming their life and spreading to another victim. ",Sarah Michelle Gellar, Jason Behr, Clea DuVall, William Mapother,The Grudge,2004,1123
Jay Russell,6.5,115 mins.,/title/tt0349710/,"Under the watchful eye of his mentor Captain Mike Kennedy,  probationary firefighter Jack Morrison matures... ",Joaquin Phoenix, John Travolta, Jacinda Barrett, Robert Patrick,Ladder 49,2004,1124
Alexander Payne,7.5,126 mins.,/title/tt0375063/,"Two men reaching middle age with not much to show but disappointment embark on a week-long road trip through California's wine country,  just as one is about to take a trip down the aisle. ",Paul Giamatti, Thomas Haden Church, Virginia Madsen, Sandra Oh,Sideways,2004,1125
D.J. Caruso,6.2,103 mins.,/title/tt0364045/,An FBI profiler is called in by French Canadian police to catch a serial killer who takes on the identity of each new victim. ,Angelina Jolie, Ethan Hawke, Kiefer Sutherland, Gena Rowlands,Taking Lives,2004,1126
Rob Bowman,4.8,97 mins.,/title/tt0357277/,"Elektra the warrior survives a near-death experience,  becomes an assassin-for-hire,  and tries to protect her two latest targets,  a single father and his young daughter,  from a group of supernatural assassins. ",Jennifer Garner, Goran Visnjic, Will Yun Lee, Kirsten Prout,Elektra,2005,1127
Nigel Cole,6.6,107 mins.,/title/tt0391304/,"On a flight from Los Angeles to New York,  Oliver and Emily make a connection,  only to decide that they are poorly suited to be together... ",Ashton Kutcher, Amanda Peet, Taryn Manning, Aimee Garcia,A Lot Like Love,2005,1128
Chris Wedge,6.3,91 mins.,/title/tt0358082/,"In a robot world,  a young idealistic inventor travels to the big city to join his inspiration's company,  only to find himself opposing its sinister new management. ",Ewan McGregor, Halle Berry, Mel Brooks, Robin Williams,Robots,2005,1129
Robert Schwentke,6.2,98 mins.,/title/tt0408790/,"A bereaved woman and her daughter are flying home from Berlin to America. At 30, 000 feet,  the child vanishes,  and nobody will admit she was ever on the plane. ",Jodie Foster, Peter Sarsgaard, Sean Bean, Kate Beahan,Flightplan,2005,1130
Cory Edwards,6.5,80 mins.,/title/tt0443536/,"Little Red Riding Hood,  the Wolf,  the Woodsman,  and Granny all tell the police the events that lead up to their encounter. ",Anne Hathaway, Glenn Close, Patrick Warburton, Jim Belushi,Hoodwinked!,2005,1131
Darren Lynn Bousman,6.6,93 mins.,/title/tt0432348/,A detective and his team must rescue eight people trapped in a factory by the twisted serial killer known as Jigsaw. ,Donnie Wahlberg, Beverley Mitchell, Franky G, Emmanuelle Vaugier,Saw II,2005,1132
Jay Chandrasekhar,6.3,110 mins.,/title/tt0486551/,"Two brothers travel to Germany for Oktoberfest,  only to stumble upon a secret,  centuries-old competition described as a ""Fight Club"" with beer games. ",Jay Chandrasekhar, Kevin Heffernan, Steve Lemme, Paul Soter,Beerfest,2006,1133
Renny Harlin,5.3,97 mins.,/title/tt0475944/,"Four young men who belong to a New England supernatural legacy are forced to battle a fifth power long thought to have died out. Meanwhile,  jealousy and suspicion threaten to tear them apart. ",Steven Strait, Sebastian Stan, Toby Hemingway, Taylor Kitsch,The Covenant,2006,1134
David Bowers,6.6,85 mins.,/title/tt0424095/,"The story of an uptown rat that gets flushed down the toilet from his penthouse apartment,  ending in the sewers of London,  where he has to learn a whole new and different way of life. ",Hugh Jackman, Kate Winslet, Ian McKellen, Jean Reno,Flushed Away,2006,1135
Andrew Davis,6.9,139 mins.,/title/tt0406816/,"A high school swim champion with a troubled past enrolls in the U.S. Coast Guard's ""A"" School,  where legendary rescue swimmer Ben Randall teaches him some hard lessons about loss,  love,  and self-sacrifice. ",Kevin Costner, Ashton Kutcher, Sela Ward, Melissa Sagemiller,The Guardian,2006,1136
John Bonito,4.7,92 mins.,/title/tt0419946/,A group of diamond thieves on the run kidnap the wife of a recently discharged marine who goes on a chase through the South Carolinian wilderness to retrieve her. ,John Cena, Kelly Carlson, Robert Patrick, Anthony Ray Parker,The Marine,2006,1137
Michael Mann,6,134 mins.,/title/tt0430357/,"Based on the 1980s TV action/drama,  this update focuses on vice detectives Crockett and Tubbs as their respective personal and professional lives become dangerously intertwined. ",Colin Farrell, Jamie Foxx, Li Gong, Naomie Harris,Miami Vice,2006,1138
Gil Kenan,6.6,91 mins.,/title/tt0385880/,"Three teens discover that their neighbor's house is really a living,  breathing,  scary monster. ",Mitchel Musso, Sam Lerner, Spencer Locke, Ryan Newman,Monster House,2006,1139
Luc Besson,6,94 mins.,/title/tt0344854/,"Ten-year-old Arthur,  in a bid to save his grandfather's house from being demolished,  goes looking for some much-fabled hidden treasure in the land of the Minimoys,  a tiny people living in harmony with nature. ",Freddie Highmore, Mia Farrow, Madonna, Ron Crawford,Arthur and the Invisibles,2006,1140
Sylvester Stallone,7.2,102 mins.,/title/tt0479143/,"Thirty years after the ring of the first bell,  Rocky Balboa comes out of retirement and dons his gloves for his final fight; against the reigning heavyweight champ Mason 'The Line' Dixon. ",Sylvester Stallone, Antonio Tarver, Milo Ventimiglia, Burt Young,Rocky Balboa,2006,1141
Tim Hill,5.2,92 mins.,/title/tt0952640/,"A struggling songwriter named Dave Seville finds success when he comes across a trio of singing chipmunks: mischievous leader Alvin,  brainy Simon,  and chubby,  impressionable Theodore. ",Jason Lee, David Cross, Cameron Richardson, Jane Lynch,Alvin and the Chipmunks,2007,1142
Josh Gordon,6.3,93 mins.,/title/tt0445934/,"In 2002,  two rival Olympic ice skaters were stripped of their gold medals and permanently banned from men's single competition. Presently,  however,  they've found a loophole that will allow them to qualify as a pairs team. ",Will Ferrell, Jon Heder, Amy Poehler, Will Arnett,Blades of Glory,2007,1143
Tim Story,5.6,92 mins.,/title/tt0486576/,The Fantastic Four learn that they aren't the only super-powered beings in the universe when they square off against the powerful Silver Surfer and the planet-eating Galactus. ,Ioan Gruffudd, Jessica Alba, Chris Evans, Michael Chiklis,Fantastic Four: Rise of the Silver Surfer,2007,1144
Garry Marshall,5.9,113 mins.,/title/tt0791304/,"A troubled young woman is sent to live with her grandmother for the summer,  while hiding a secret that could potentially tear her family apart. ",Jane Fonda, Lindsay Lohan, Felicity Huffman, Dermot Mulroney,Georgia Rule,2007,1145
Rob Zombie,6.1,109 mins.,/title/tt0373883/,"After being committed for 17 years,  Michael Myers,  now a grown man and still very dangerous,  escapes from the mental institution where he was committed as a 10 year old and he immediately returns to Haddonfield,  where he wants to find his baby sister,  Laurie. Anyone who crosses his path is in mortal danger. ",Scout Taylor-Compton, Malcolm McDowell, Tyler Mane, Brad Dourif,Halloween,2007,1146
Robert Redford,6.2,92 mins.,/title/tt0891527/,"Injuries sustained by two Army rangers behind enemy lines in Afghanistan set off a sequence of events involving a congressman,  a journalist and a professor. ",Tom Cruise, Meryl Streep, Robert Redford, Michael PeÕ±a,Lions for Lambs,2007,1147
Mike Binder,7.5,124 mins.,/title/tt0490204/,A man who lost his family in the September 11 attack on New York City runs into his old college roommate. Rekindling the friendship is the one thing that appears able to help the man recover from his grief. ,Adam Sandler, Don Cheadle, Jada Pinkett Smith, Liv Tyler,Reign Over Me,2007,1148
Michael Davis,6.7,86 mins.,/title/tt0465602/,"A man named Mr. Smith delivers a woman's baby during a shootout,  and is then called upon to protect the newborn from the army of gunmen. ",Clive Owen, Monica Bellucci, Paul Giamatti, Stephen McHattie,Shoot 'Em Up,2007,1149
Ash Brannon,6.8,85 mins.,/title/tt0423294/,"A behind-the-scenes look at the annual Penguin World Surfing Championship,  and its newest participant,  up-and-comer Cody Maverick. ",Shia LaBeouf, Zooey Deschanel, Jon Heder, Jeff Bridges,Surf's Up,2007,1150
