director,user_rating,runtime,link,description,star1,star2,star3,star4,title,year,rank
Barry Battles,6.4,98 mins.,/title/tt1836944/,"When three redneck brothers agree to help a woman save her godson from an abusive stepfather,  they become targets on the run from an odd cast of characters. ",Billy Bob Thornton, Eva Longoria, Thomas Brodie-Sangster, Clayne Crawford,The Baytown Outlaws,2012,523
Terrence Malick,6.8,139 mins.,/title/tt0478304/,"The story of a family in Waco,  Texas in 1956. The eldest son witnesses the loss of innocence and struggles with his parents' conflicting teachings. ",Brad Pitt, Sean Penn, Jessica Chastain, Hunter McCracken,The Tree of Life,2011,524
William Friedkin,6.7,102 mins.,/title/tt1726669/,"When a debt puts a young man's life in danger,  he turns to putting a hit out on his evil mother in order to collect the insurance. ",Matthew McConaughey, Emile Hirsch, Juno Temple, Thomas Haden Church,Killer Joe,2011,525
Debra Granik,7.2,100 mins.,/title/tt1399683/,An unflinching Ozark Mountain girl hacks through dangerous social terrain as she hunts down her drug-dealing father while trying to keep her family intact. ,Jennifer Lawrence, John Hawkes, Garret Dillahunt, Isaiah Stone,Winter's Bone,2010,526
John Hillcoat,7.3,111 mins.,/title/tt0898367/,"In a dangerous post-apocalyptic world,  an ailing father defends his son as they slowly travel to the sea. ",Viggo Mortensen, Charlize Theron, Kodi Smit-McPhee, Robert Duvall,The Road,2009,527
Martin McDonagh,8,107 mins.,/title/tt0780536/,"Guilt-stricken after a job gone wrong,  hitman Ray and his partner await orders from their ruthless boss in Bruges,  Belgium,  the last place in the world Ray wants to be. ",Colin Farrell, Brendan Gleeson, CiarÕçn Hinds, Elizabeth Berrington,In Bruges,2008,528
Danny Boyle,7.3,107 mins.,/title/tt0448134/,A team of international astronauts are sent on a dangerous mission to reignite the dying Sun with a nuclear fission bomb in 2057. ,Cillian Murphy, Rose Byrne, Chris Evans, Michelle Yeoh,Sunshine,2007,529
Alfonso CuarÕ_n,7.9,109 mins.,/title/tt0206634/,"In 2027,  in a chaotic world in which women have become somehow infertile,  a former activist agrees to help transport a miraculously pregnant woman to a sanctuary at sea. ",Julianne Moore, Clive Owen, Chiwetel Ejiofor, Michael Caine,Children of Men,2006,530
Brad Anderson,7.7,101 mins.,/title/tt0361862/,An industrial worker who hasn't slept in a year begins to doubt his own sanity. ,Christian Bale, Jennifer Jason Leigh, Aitana SÕçnchez-GijÕ_n, John Sharian,The Machinist,2004,531
Gregory J. Read,6.4,110 mins.,/title/tt0425196/,A forensic psychologist Collette is tasked with determining whether or not a minor should face murder charges for killing his schoolmate. ,Eddie Redmayne, Tom Sturridge, Toni Collette, Richard Roxburgh,Like Minds,2006,532
Kurt Wimmer,7.5,107 mins.,/title/tt0238380/,"In a fascist future where all forms of feeling are illegal,  a man in charge of enforcing the law rises to overthrow the system. ",Christian Bale, Sean Bean, Emily Watson, Taye Diggs,Equilibrium,2002,533
Guy Ritchie,8.2,107 mins.,/title/tt0120735/,"A botched card game in London triggers four friends,  thugs,  weed-growers,  hard gangsters,  loan sharks and debt collectors to collide with each other in a series of unexpected events,  all for the sake of weed,  cash and two antique shotguns. ",Jason Flemyng, Dexter Fletcher, Nick Moran, Jason Statham,"Lock,  Stock and Two Smoking Barrels",1998,534
Christopher Nolan,8.6,169 mins.,/title/tt0816692/,A team of explorers travel through a wormhole in space in an attempt to ensure humanity's survival. ,Matthew McConaughey, Anne Hathaway, Jessica Chastain, Mackenzie Foy,Interstellar,2014,535
Gareth Edwards,6.5,123 mins.,/title/tt0831387/,"The world is beset by the appearance of monstrous creatures,  but one of them may be the only one who can save humanity. ",Aaron Taylor-Johnson, Elizabeth Olsen, Bryan Cranston, Ken Watanabe,Godzilla,2014,536
Richard Linklater,7.9,109 mins.,/title/tt2209418/,We meet Jesse and Celine nine years on in Greece. Almost two decades have passed since their first meeting on that train bound for Vienna. ,Ethan Hawke, Julie Delpy, Seamus Davey-Fitzpatrick, Ariane Labed,Before Midnight,2013,537
Paul Feig,6.6,117 mins.,/title/tt2404463/,An uptight FBI Special Agent is paired with a foul-mouthed Boston cop to take down a ruthless drug lord. ,Sandra Bullock, Michael McDonald, Melissa McCarthy, DemiÕçn Bichir,The Heat,2013,538
James Wan,7.5,112 mins.,/title/tt1457767/,Paranormal investigators Ed and Lorraine Warren work to help a family terrorized by a dark presence in their farmhouse. ,Patrick Wilson, Vera Farmiga, Ron Livingston, Lili Taylor,The Conjuring,2013,539
Jim Sharman,7.4,100 mins.,/title/tt0073629/,A newly engaged couple have a breakdown in an isolated area and must pay a call to the bizarre residence of Dr. Frank-N-Furter. ,Tim Curry, Susan Sarandon, Barry Bostwick, Richard O'Brien,The Rocky Horror Picture Show,1975,540
Terry Gilliam,8.3,91 mins.,/title/tt0071853/,"King Arthur and his knights embark on a low-budget search for the Grail,  encountering many,  very silly obstacles. ",Graham Chapman, John Cleese, Eric Idle, Terry Gilliam,Monty Python and the Holy Grail,1975,541
William Friedkin,8,122 mins.,/title/tt0070047/,"When a teenage girl is possessed by a mysterious entity,  her mother seeks the help of two priests to save her daughter. ",Ellen Burstyn, Max von Sydow, Linda Blair, Lee J. Cobb,The Exorcist,1973,542
John G. Avildsen,8.1,120 mins.,/title/tt0075148/,"Rocky Balboa,  a small-time boxer,  gets a supremely rare chance to fight heavy-weight champion Apollo Creed in a bout in which he strives to go the distance for his self-respect. ",Sylvester Stallone, Talia Shire, Burt Young, Carl Weathers,Rocky,1976,543
Richard Donner,7.3,143 mins.,/title/tt0078346/,"An alien orphan is sent from his dying planet to Earth,  where he grows up to become his adoptive home's first and greatest superhero. ",Christopher Reeve, Margot Kidder, Gene Hackman, Marlon Brando,Superman,1978,544
John Carpenter,8.2,109 mins.,/title/tt0084787/,A research facility in Antarctica comes across an alien force that can become anything it touches with 100% accuracy. The members must now find out who's human and who's not before it's too late. ,Kurt Russell, Wilford Brimley, Keith David, Richard Masur,The Thing,1982,545
James L. Brooks,7.4,132 mins.,/title/tt0086425/,Follows hard-to-please Aurora looking for love and her daughter's family problems. ,Shirley MacLaine, Debra Winger, Jack Nicholson, Danny DeVito,Terms of Endearment,1983,546
Steven Spielberg,7.6,118 mins.,/title/tt0087469/,"After arriving in India,  Indiana Jones is asked by a desperate village to find a mystical stone. He agrees,  and stumbles upon a secret cult plotting a terrible plan in the catacombs of an ancient palace. ",Harrison Ford, Kate Capshaw, Jonathan Ke Quan, Amrish Puri,Indiana Jones and the Temple of Doom,1984,547
Wolfgang Petersen,7.4,102 mins.,/title/tt0088323/,A troubled boy dives into a wondrous fantasy world through the pages of a mysterious book. ,Noah Hathaway, Barret Oliver, Tami Stronach, Gerald McRaney,The NeverEnding Story,1984,548
Joel Schumacher,7.2,97 mins.,/title/tt0093437/,"After moving to a new town,  two brothers discover that the area is a haven for vampires. ",Jason Patric, Corey Haim, Dianne Wiest, Barnard Hughes,The Lost Boys,1987,549
Mel Brooks,7.1,96 mins.,/title/tt0094012/,"Planet Spaceballs' President Skroob sends Lord Dark Helmet to steal planet Druidia's abundant supply of air to replenish their own,  and only Lone Starr can stop them. ",Mel Brooks, John Candy, Rick Moranis, Bill Pullman,Spaceballs,1987,550
Tim Burton,7.5,92 mins.,/title/tt0094721/,"A couple of recently deceased ghosts contract the services of a ""bio-exorcist"" in order to remove the obnoxious new owners of their house. ",Alec Baldwin, Geena Davis, Michael Keaton, Annie McEnroe,Beetlejuice,1988,551
Tim Burton,7.6,126 mins.,/title/tt0096895/,The Dark Knight of Gotham City begins his war on crime with his first major enemy being the clownishly homicidal Joker. ,Michael Keaton, Jack Nicholson, Kim Basinger, Robert Wuhl,Batman,1989,552
Francis Ford Coppola,7.6,162 mins.,/title/tt0099674/,"In the midst of trying to legitimize his business dealings in New York and Italy in 1979,  aging Mafia don Michael Corleone seeks to avow for his sins while taking a young protÕ©gÕ© under his wing. ",Al Pacino, Diane Keaton, Andy Garcia, Talia Shire,The Godfather: Part III,1990,553
Paul Verhoeven,6.9,127 mins.,/title/tt0103772/,"A violent,  suspended police detective investigates a brutal murder,  in which a manipulative and seductive woman could be involved. ",Michael Douglas, Sharon Stone, George Dzundza, Jeanne Tripplehorn,Basic Instinct,1992,554
Rob Reiner,7.6,138 mins.,/title/tt0104257/,Neo military lawyer Kaffee defends Marines accused of murder; they contend they were acting under orders. ,Tom Cruise, Jack Nicholson, Demi Moore, Kevin Bacon,A Few Good Men,1992,555
Agnieszka Holland,7.3,101 mins.,/title/tt0108071/,A young British girl born and raised in India loses her neglectful parents in an earthquake. She is returned to England to live at her uncle's estate... ,Kate Maberly, Maggie Smith, Heydon Prowse, Andrew Knott,The Secret Garden,1993,556
Tony Scott,8,120 mins.,/title/tt0108399/,"In Detroit,  a lonely pop culture geek marries a call girl,  steals cocaine from her pimp,  and tries to sell it in Hollywood. Meanwhile,  the owners of the cocaine - the Mob - track them down in an attempt to reclaim it. ",Christian Slater, Patricia Arquette, Dennis Hopper, Val Kilmer,True Romance,1993,557
Lasse HallstrÕ_m,7.8,118 mins.,/title/tt0108550/,"After his father's death,  Gilbert has to care for his mentally disabled brother,  Arnie,  and his morbidly obese mother,  which is suddenly challenged when love walks into his life. ",Johnny Depp, Leonardo DiCaprio, Juliette Lewis, Mary Steenburgen,What's Eating Gilbert Grape,1993,558
James Cameron,7.2,141 mins.,/title/tt0111503/,"A fearless,  globe-trotting,  terrorist-battling secret agent has his life turned upside down when he discovers his wife might be having an affair with a used car salesman. ",Arnold Schwarzenegger, Jamie Lee Curtis, Tom Arnold, Bill Paxton,True Lies,1994,559
John McTiernan,7.6,128 mins.,/title/tt0112864/,"John McClane and a Harlem store owner are targeted by German terrorist Simon Gruber in New York City,  where he plans to rob the Federal Reserve Building. ",Bruce Willis, Jeremy Irons, Samuel L. Jackson, Graham Greene,Die Hard with a Vengeance,1995,560
F. Gary Gray,7.3,91 mins.,/title/tt0113118/,"Two homies,  Smokey and Craig,  smoke a dope dealer's weed and try to figure a way to get the $200 they owe to the dealer by 10 p.m. that same night. In that time,  they smoke more weed and get jacked and shot at in a drive-by. ",Ice Cube, Chris Tucker, Nia Long, Tommy 'Tiny' Lister,Friday,1995,561
Iain Softley,6.2,107 mins.,/title/tt0113243/,A young boy is arrested by the U.S. Secret Service for writing a computer virus and is banned from using a computer until his 18th birthday... ,Jonny Lee Miller, Angelina Jolie, Jesse Bradford, Matthew Lillard,Hackers,1995,562
Robert Rodriguez,7.3,108 mins.,/title/tt0116367/,"Two criminals and their hostages unknowingly seek temporary refuge in an establishment populated by vampires,  with chaotic results. ",Harvey Keitel, George Clooney, Juliette Lewis, Quentin Tarantino,From Dusk Till Dawn,1996,563
Peter Macdonald,3.1,95 mins.,/title/tt0110647/,A young boy must restore order when a group of bullies steal the magical book that acts as a portal between Earth and the imaginary world of Fantasia. ,Jason James Richter, Melody Kay, Jack Black, Carole Finn,The Neverending Story III,1994,564
Joel Schumacher,7.4,149 mins.,/title/tt0117913/,"In Canton,  Mississippi,  a fearless young lawyer and his assistant defend a black man accused of murdering two white men who raped his 10-year-old daughter,  inciting a revolt by local racist groups. ",Matthew McConaughey, Sandra Bullock, Samuel L. Jackson, Kevin Spacey,A Time to Kill,1996,565
Tim Burton,6.3,106 mins.,/title/tt0116996/,Earth is invaded by Martians with unbeatable weapons and a cruel sense of humor. ,Jack Nicholson, Pierce Brosnan, Sarah Jessica Parker, Annette Bening,Mars Attacks!,1996,566
Wes Craven,7.2,111 mins.,/title/tt0117571/,"A year after the murder of her mother,  a teenage girl is terrorized by a new killer,  who targets the girl and her friends by using horror films as part of a deadly game. ",Neve Campbell, Courteney Cox, David Arquette, Skeet Ulrich,Scream,1996,567
David Fincher,7.8,129 mins.,/title/tt0119174/,"Nicholas Van Orton is a very wealthy San Francisco banker,  but he is an absolute loner,  even spending his birthday alone... ",Michael Douglas, Deborah Kara Unger, Sean Penn, James Rebhorn,The Game,1997,568
Quentin Tarantino,7.5,154 mins.,/title/tt0119396/,A middle-aged woman finds herself in the middle of a huge conflict that will either make her a profit or cost her life. ,Pam Grier, Samuel L. Jackson, Robert Forster, Bridget Fonda,Jackie Brown,1997,569
Paul Verhoeven,7.2,129 mins.,/title/tt0120201/,"Humans in a fascistic,  militaristic future do battle with giant alien bugs in a fight for survival. ",Casper Van Dien, Denise Richards, Dina Meyer, Jake Busey,Starship Troopers,1997,570
Tony Bancroft,7.5,88 mins.,/title/tt0120762/,"To save her father from death in the army,  a young maiden secretly goes in his place and becomes one of China's greatest heroines in the process. ",Ming-Na Wen, Eddie Murphy, BD Wong, Lea Salonga,Mulan,1998,571
John Lasseter,7.2,95 mins.,/title/tt0120623/,"A misfit ant,  looking for ""warriors"" to save his colony from greedy grasshoppers,  recruits a group of bugs that turn out to be an inept circus troupe. ",Kevin Spacey, Dave Foley, Julia Louis-Dreyfus, Hayden Panettiere,A Bug's Life,1998,572
Stanley Kubrick,7.3,159 mins.,/title/tt0120663/,"A New York City doctor,  who is married to an art curator,  pushes himself on a harrowing and dangerous night-long odyssey of sexual and moral discovery after his wife admits that she once almost cheated on him. ",Tom Cruise, Nicole Kidman, Todd Field, Sydney Pollack,Eyes Wide Shut,1999,573
Robert Zemeckis,7.7,143 mins.,/title/tt0162222/,A FedEx executive must transform himself physically and emotionally to survive a crash landing on a deserted island. ,Tom Hanks, Helen Hunt, Paul Sanchez, Lari White,Cast Away,2000,574
Dominic Sena,6.5,118 mins.,/title/tt0187078/,A retired master car thief must come back to the industry and steal 50 cars with his crew in one night to save his brother's life. ,Nicolas Cage, Angelina Jolie, Giovanni Ribisi, T.J. Cross,Gone in Sixty Seconds,2000,575
Kevin Smith,6.9,104 mins.,/title/tt0261392/,"The comic 'Bluntman and Chronic' is based on real-life stoners Jay and Silent Bob,  so when they get no profit from a big-screen adaptation they set out to wreck the movie. ",Jason Mewes, Kevin Smith, Ben Affleck, Jeff Anderson,Jay and Silent Bob Strike Back,2001,576
Stephen Sommers,6.3,130 mins.,/title/tt0209163/,"The mummified body of Imhotep is shipped to a museum in London,  where he once again wakes and begins his campaign of rage and terror. ",Brendan Fraser, Rachel Weisz, John Hannah, Arnold Vosloo,The Mummy Returns,2001,577
Joel Gallen,5.7,89 mins.,/title/tt0277371/,A sendup of all the teen movies that have accumulated in the past two decades. ,Chyler Leigh, Jaime Pressly, Chris Evans, Eric Christian Olsen,Not Another Teen Movie,2001,578
Tim Burton,5.7,119 mins.,/title/tt0133152/,"An Air Force astronaut crash lands on a mysterious planet where evolved,  talking apes dominate a race of primitive humans. ",Mark Wahlberg, Helena Bonham Carter, Tim Roth, Michael Clarke Duncan,Planet of the Apes,2001,579
Ben Stiller,6.6,90 mins.,/title/tt0196229/,"At the end of his career,  a clueless fashion model is brainwashed to kill the Prime Minister of Malaysia. ",Ben Stiller, Owen Wilson, Christine Taylor, Will Ferrell,Zoolander,2001,580
Jay Chandrasekhar,7.1,100 mins.,/title/tt0247745/,"Five Vermont state troopers,  avid pranksters with a knack for screwing up,  try to save their jobs and out-do the local police department by solving a crime. ",Jay Chandrasekhar, Kevin Heffernan, AndrÕ© Vippolis, Joey Kern,Super Troopers,2001,581
Lee Tamahori,6.1,133 mins.,/title/tt0246460/,James Bond is sent to investigate the connection between a North Korean terrorist and a diamond mogul who is funding the development of an international space weapon. ,Pierce Brosnan, Halle Berry, Rosamund Pike, Toby Stephens,Die Another Day,2002,582
Chris Wedge,7.6,81 mins.,/title/tt0268380/,"Set during the Ice Age,  a sabertooth tiger,  a sloth,  and a wooly mammoth find a lost human infant,  and they try to return him to his tribe. ",Denis Leary, John Leguizamo, Ray Romano, Goran Visnjic,Ice Age,2002,583
Paul W.S. Anderson,6.7,100 mins.,/title/tt0120804/,"A special military unit fights a powerful,  out-of-control supercomputer and hundreds of scientists who have mutated into flesh-eating creatures after a laboratory accident. ",Milla Jovovich, Michelle Rodriguez, Ryan McCluskey, Oscar Pearce,Resident Evil,2002,584
Gore Verbinski,7.1,115 mins.,/title/tt0298130/,A journalist must investigate a mysterious videotape which seems to cause the death of anyone in a week of viewing it. ,Naomi Watts, Martin Henderson, Brian Cox, David Dorfman,The Ring,2002,585
John Singleton,5.9,107 mins.,/title/tt0322259/,Former cop Brian O'Conner is called upon to bust a dangerous criminal and he recruits the help of a former childhood friend and street racer who has a chance to redeem himself. ,Paul Walker, Tyrese Gibson, Cole Hauser, Eva Mendes,2 Fast 2 Furious,2003,586
Peter Segal,6.2,106 mins.,/title/tt0305224/,"Dave Buznik is a businessman who is wrongly sentenced to an anger-management program,  where he meets an aggressive instructor. ",Jack Nicholson, Adam Sandler, Marisa Tomei, Luis GuzmÕçn,Anger Management,2003,587
Ang Lee,5.7,138 mins.,/title/tt0286716/,"Bruce Banner,  a genetics researcher with a tragic past,  suffers an accident that causes him to transform into a raging green monster when he gets angry. ",Eric Bana, Jennifer Connelly, Sam Elliott, Josh Lucas,Hulk,2003,588
James Mangold,7.3,90 mins.,/title/tt0309698/,"Stranded at a desolate Nevada motel during a nasty rain-storm,  ten strangers become acquainted with each other when they realize that they're being killed off one by one. ",John Cusack, Ray Liotta, Amanda Peet, John Hawkes,Identity,2003,589
Rob Schmidt,6.1,84 mins.,/title/tt0295700/,"Six people find themselves trapped in the woods of West Virginia,  hunted down by ""cannibalistic mountain men grossly disfigured through generations of in-breeding."" ",Eliza Dushku, Jeremy Sisto, Emmanuelle Chriqui, Desmond Harrington,Wrong Turn,2003,590
Terry Zwigoff,7.1,91 mins.,/title/tt0307987/,"A miserable conman and his partner pose as Santa and his Little Helper to rob department stores on Christmas Eve. But they run into problems when the conman befriends a troubled kid,  and the security boss discovers the plot. ",Billy Bob Thornton, Bernie Mac, Lauren Graham, John Ritter,Bad Santa,2003,591
David Twohy,6.7,119 mins.,/title/tt0296572/,"The wanted criminal Riddick arrives on a planet called Helion Prime,  and finds himself up against an invading empire called the Necromongers,  an army that plans to convert or kill all humans in the universe. ",Vin Diesel, Judi Dench, Colm Feore, Thandie Newton,The Chronicles of Riddick,2004,592
Zack Snyder,7.4,101 mins.,/title/tt0363547/,"A nurse,  a policeman,  a young married couple,  a salesman,  and other survivors of a worldwide plague that is producing aggressive,  flesh-eating zombies,  take refuge in a mega Midwestern shopping mall. ",Sarah Polley, Ving Rhames, Mekhi Phifer, Jake Weber,Dawn of the Dead,2004,593
Roland Emmerich,6.4,124 mins.,/title/tt0319262/,"Jack Hall,  paleoclimatologist,  must make a daring trek across America to reach his son,  trapped in the cross-hairs of a sudden international storm which plunges the planet into a new Ice Age. ",Dennis Quaid, Jake Gyllenhaal, Emmy Rossum, Dash Mihok,The Day After Tomorrow,2004,594
Brad Silberling,6.8,108 mins.,/title/tt0339291/,"When a massive fire kills their parents,  three children are delivered to the custody of cousin and stage actor Count Olaf,  who is secretly plotting to steal their parents' vast fortune. ",Jim Carrey, Jude Law, Meryl Streep, Liam Aiken,A Series of Unfortunate Events,2004,595
Tony Scott,7.7,146 mins.,/title/tt0328107/,"In Mexico City,  a former assassin swears vengeance on those who committed an unspeakable act against the family he was hired to protect. ",Denzel Washington, Christopher Walken, Dakota Fanning, Radha Mitchell,Man on Fire,2004,596
Steven Soderbergh,6.5,125 mins.,/title/tt0349903/,Daniel Ocean recruits one more team member so he can pull off three major European heists in this sequel to Ocean's 11. ,George Clooney, Brad Pitt, Julia Roberts, Catherine Zeta-Jones,Ocean's Twelve,2004,597
James Wan,7.7,103 mins.,/title/tt0387564/,"Two strangers awaken in a room with no recollection of how they got there or why,  and soon discover they are pawns in a deadly game perpetrated by a notorious serial killer. ",Cary Elwes, Leigh Whannell, Danny Glover, Ken Leung,Saw,2004,598
Andrew Adamson,7.2,93 mins.,/title/tt0298148/,Princess Fiona's parents invite her and Shrek to dinner to celebrate her marriage. If only they knew the newlyweds were both ogres. ,Mike Myers, Eddie Murphy, Cameron Diaz, Julie Andrews,Shrek 2,2004,599
Keenen Ivory Wayans,5.5,109 mins.,/title/tt0381707/,Two disgraced FBI agents go way undercover in an effort to protect hotel heiresses the Wilson Sisters from a kidnapping plot. ,Marlon Wayans, Shawn Wayans, Busy Philipps, Maitland Ward,White Chicks,2004,600
Andrew Douglas,6,90 mins.,/title/tt0384806/,Newlyweds are terrorized by demonic forces after moving into a large house that was the site of a grisly mass murder a year before. ,Ryan Reynolds, Melissa George, Jimmy Bennett, Jesse James,The Amityville Horror,2005,601
Francis Lawrence,6.9,121 mins.,/title/tt0360486/,"Supernatural detective John Constantine helps a policewoman prove her sister's death was not a suicide,  but something more. ",Keanu Reeves, Rachel Weisz, Djimon Hounsou, Shia LaBeouf,Constantine,2005,602
Adam Shankman,5.4,94 mins.,/title/tt0452598/,"The Bakers,  while on vacation,  find themselves competing with a rival family of eight children. ",Steve Martin, Bonnie Hunt, Hilary Duff, Eugene Levy,Cheaper by the Dozen 2,2005,603
George A. Romero,6.2,93 mins.,/title/tt0418819/,"The living dead have taken over the world,  and the last humans live in a walled city to protect themselves as they come to grips with the situation. ",John Leguizamo, Asia Argento, Simon Baker, Dennis Hopper,Land of the Dead,2005,604
Neveldine,7,88 mins.,/title/tt0479884/,Professional assassin Chev Chelios learns his rival has injected him with a poison that will kill him if his heart rate drops. ,Jason Statham, Amy Smart, Carlos Sanz, Jose Pablo Cantillo,Crank,2006,605
Ron Howard,6.6,149 mins.,/title/tt0382625/,A murder inside the Louvre and clues in Da Vinci paintings lead to the discovery of a religious mystery protected by a secret society for two thousand years -- which could shake the foundations of Christianity. ,Tom Hanks, Audrey Tautou, Jean Reno, Ian McKellen,The Da Vinci Code,2006,606
Nicholaus Goossen,7,94 mins.,/title/tt0456554/,A 35 year old video game tester has to move in with his grandma and her two old lady roommates. ,Allen Covert, Linda Cardellini, Shirley Jones, Peter Dante,Grandma's Boy,2006,607
Jonathan Dayton,7.8,101 mins.,/title/tt0449059/,A family determined to get their young daughter into the finals of a beauty pageant take a cross-country trip in their VW bus. ,Steve Carell, Toni Collette, Greg Kinnear, Abigail Breslin,Little Miss Sunshine,2006,608
Paul McGuigan,7.8,110 mins.,/title/tt0425210/,A case of mistaken identity lands Slevin into the middle of a war being plotted by two of the city's most rival crime bosses: The Rabbi and The Boss. Slevin is under constant surveillance by relentless Detective Brikowski as well as the infamous assassin Goodkat and finds himself having to hatch his own ingenious plot to get them before they get him. ,Josh Hartnett, Ben Kingsley, Morgan Freeman, Lucy Liu,Lucky Number Slevin,2006,609
Mel Gibson,7.8,139 mins.,/title/tt0472043/,"As the Mayan kingdom faces its decline,  the rulers insist the key to prosperity is to build more temples and offer human sacrifices. Jaguar Paw,  a young man captured for sacrifice,  flees to avoid his fate. ",Gerardo Taracena, Raoul Max Trujillo, Dalia HernÕçndez, Rudy Youngblood,Apocalypto,2006,610
Juan Carlos Fresnadillo,7,100 mins.,/title/tt0463854/,"Six months after the rage virus was inflicted on the population of Great Britain,  the US Army helps to secure a small area of London for the survivors to repopulate and start again. But not everything goes to plan. ",Jeremy Renner, Rose Byrne, Robert Carlyle, Harold Perrineau,28 Weeks Later,2007,611
Kirsten Sheridan,7.5,114 mins.,/title/tt0426931/,"A drama with fairy tale elements,  where an orphaned musical prodigy uses his gift as a clue to finding his birth parents. ",Freddie Highmore, Keri Russell, Jonathan Rhys Meyers, Terrence Howard,August Rush,2007,612
Gabor Csupo,7.2,96 mins.,/title/tt0398808/,A preteen's life turns upside down when he befriends the new girl in school and they imagine a whole new fantasy world to escape reality. ,Josh Hutcherson, AnnaSophia Robb, Zooey Deschanel, Robert Patrick,Bridge to Terabithia,2007,613
